,created_utc,num_comments,subreddit,title,is_video,num_crossposts,score,subreddit_subscribers
2040,1527541381.0,11,rugbyunion,Gibson-Park gets it,False,0,85,66849
2041,1527542828.0,22,DesignerReps,[WTC] this D&amp;G crewneck? Ill honestly buy retail at this point.,False,0,75,49626
2042,1527533454.0,33,Destiny,I am also very critical of you guys and this subreddit.,False,0,127,33320
2043,1527544138.0,15,chemicalreactiongifs,Create Hydrogen-Floating Balloons with Aluminium and Drain Cleaner,True,0,109,386661
2044,1527516948.0,1,ImaginaryCharacters,'Welcome Gentlemen!' by Sina Hayati,False,0,296,75899
2045,1527550798.0,1,unexpectedhogwarts,Writing tip,False,0,78,52055
2046,1527535705.0,3,Colorization,"Australian Troops with Kangaroo &amp; Dog - Australia, 1943 (colourised)",False,0,109,53376
2047,1527541559.0,4,PanPorn,Almost two years later on this,False,0,87,24835
2048,1527542181.0,21,spaceporn,Gaia's latest super high-res color shot of the Galaxy [4300x2708],False,0,258,550327
2049,1527510917.0,6,catbellies,Charlie’s way to beat the heat,False,0,400,26912
2050,1527536438.0,13,FireEmblemHeroes,Camilla,False,0,511,106253
2051,1527550315.0,8,UtahJazz,"I was bored yesterday so I decided to make a video loosely following Donovan from the draft to the playoffs. Enjoy, I present to you, Donovan Mitchell: Rookie.",False,0,54,12789
2052,1527539516.0,3,Purdue,I'm looking for an unconventional donor in Lafayette.,False,0,92,11544
2053,1527545710.0,18,longisland,1938 Map of Parks in New York City and Long Island,False,0,66,13536
2054,1527539502.0,10,HollowKnight,[meme] Romance is dead,False,0,94,13393
2055,1527525735.0,11,community,Found in the Full House way. Spoiler Alert: It's bad,False,0,190,173045
2056,1527538223.0,32,BasicIncome,The Alarming Statistics That Show The U.S. Economy Isn’t As Good As It Seems,False,0,97,53346
2057,1527525901.0,21,victoria2,"As Mexico, I finally secured the Mississippi",False,0,183,12275
2058,1527538182.0,7,sewing,WIP [Self Drafted] - This is my next project for my Autumn inspiration. It’s an inverted pleated skirt with wool details in order to create a “leaf veins” look. Now i'm doing the matching blouse. I hope to finish it soon!,False,0,143,100083
2059,1527502115.0,351,PrequelMemes,Is this okay to post here?,False,2,35973,598012
2060,1527537994.0,14,hillaryclinton,Fox News pundits debate whether Hillary Clinton should go to jail for Trump's Russia scandal,False,0,102,30409
2061,1527549449.0,2,notlikeothergirls,Found on a Buzzfeed list for girls who wear all black. Yeah.,False,0,53,10037
2062,1527520407.0,6,beetlejuicing,Does this count?,False,0,247,150878
2063,1527538673.0,15,EmpireDidNothingWrong,When I asked my friend what he thought of the new Avengers,False,0,139,270046
2064,1527495280.0,54,PeopleFuckingDying,EvIl dOggO FuCkiNg trAmPlEs cAt tO DeaTh,True,0,6088,681711
2065,1527521288.0,30,LegendsOfTomorrow,Met the awesome caity lotz this weekend and she signed my white canary art,False,0,230,37504
2066,1527506580.0,51,DataHoarder,Amazon UK have finally started shipping WD Reds in proper packaging again!,False,0,496,87054
2067,1527531547.0,30,TheAmericans,Nadezhda,False,0,136,13129
2068,1527552690.0,2,WatchPeopleDieInside,At least the guy came back after.,False,0,108,395586
2069,1527499893.0,23,Nicegirls,"Only a slight overreaction, what if his mother gives him a hug?",False,0,716,141100
2070,1527478032.0,34,babyelephantgifs,Baby just wants cuddles,False,0,2222,384422
2071,1527525864.0,48,BPD,Does anyone else find that they feel depressed the second they stop being busy?,False,0,182,32630
2072,1527541791.0,25,WhatsInThisThing,Found washed up on the Hudson River (NYC),False,0,84,90949
2073,1527507548.0,21,Romania,Olguța loveşte din nou,False,0,470,71189
2074,1527542772.0,6,androidthemes,[Contest] Clean Tiles,False,0,78,78994
2075,1527544070.0,2,RachelRiley,Blue striped dress,False,0,71,8634
2076,1527506933.0,24,WTFgaragesale,Frisky ash tray,False,0,482,41625
2077,1527541745.0,4,greece,Μπορει να εχω βαρεθει το meme αλλα..,False,0,81,39499
2078,1527543418.0,222,xboxone,PUBG takes US game firm [Epic Games] to court [over Fortnite],False,0,161,741854
2079,1527511024.0,19,RetroFuturism,IGH,False,0,567,221533
2080,1527537024.0,12,Planetside,Breakfast for Planetmen,False,0,106,44508
2081,1527529029.0,10,discworld,I was reading the All About History Magazine and realised where the name of the land for the Witches came from. It was another hidden gem about where Pratchett got his inspiration from.,False,0,159,22637
2082,1527511358.0,52,whitepeoplegifs,Here you go babe.,False,0,831,400625
2083,1527531046.0,5,bertstrips,insert 1940s racial slur,False,0,206,137282
2084,1527521935.0,34,educationalgifs,Stitchless healing,False,0,484,601805
2085,1527524001.0,13,occult,Friend of mine drew this! figured you guys would love it as much as I did.,False,0,200,74634
2086,1527541800.0,2,brooklynninenine,Most intimate thing to do to a lover with your fingers,False,0,118,98890
2087,1527543339.0,4,ProtectAndServe,[Meme] Being a Detective with Millennials,False,0,110,70760
2088,1527511909.0,1,AnadeArmas,Bikini top,False,0,373,17055
2089,1527514682.0,29,FoodPorn,Homemade Full English (2893x2893) [OC],False,0,473,920704
2090,1527534704.0,24,Rochester,I made a multi layer wood map of the Rochester area. Im really proud of it and i thought you guys might like it.,False,1,117,12953
2091,1527512860.0,26,popping,You asked and I popped! A very clean removal.,True,0,521,139514
2092,1527549465.0,4,ScarySigns,level 5 goose warning!,False,0,56,39522
2093,1527537412.0,46,foodhacks,"For the few of you who still make Kraft Mac and Cheese, heat your milk and butter in the microwave or stove before adding to the macaroni.",False,0,102,367264
2094,1527515395.0,44,northernireland,Wholesome mural,False,0,307,18594
2095,1527534102.0,9,SanJoseSharks,San Jose Fire Sharks Engine,False,0,119,17651
2096,1527530598.0,2,LoveLive,Beach Day with Chika and You!,False,0,211,20338
2097,1527539130.0,14,zelda,"My wife isn't a huge cosplayer, doesn't care much for conventions, and isn't a huge fan of video games. But when Pensacon came around, I asked if she would be willing to go. To my suprise she said she loved Legend of Zelda as a kid, so we should go dressed up. I think she knocked it out of the park.",False,0,197,395780
2098,1527533395.0,3,AnimalCollective,showing people mpp when I really want to listen to hollinndagain,False,0,122,8610
2099,1527538688.0,31,beerporn,"New beer fridge, stocked for the summer",False,0,92,56246
2100,1527516796.0,15,twinpeaks,[No Spoilers] My Twin Peaks Nail Art,False,0,282,71348
2101,1527518815.0,37,transgendercirclejerk,If this gets five hundred upvotes I'll come out to my family in my suicide note.,False,0,257,13902
2102,1527545949.0,23,loseit,300 -&gt; 140 (pics included),False,0,96,849215
2103,1527532413.0,4,oregon,Just north of Florence,False,0,130,24975
2104,1527529683.0,7,uktrees,Drugs Minister Vicky,False,0,146,14499
2105,1527533767.0,5,hardwaregore,"Found this on ebay, desc says ""when powered on fans start spinning and nothing happens"" ...what fans?",False,0,121,5613
2106,1527536608.0,5,bettafish,Meet Alpha my new betta,False,0,153,33393
2107,1527508721.0,64,Fishing,My first pike ever!,False,0,634,180790
2108,1527531588.0,4,IggyAzaleasAss,All-Time Favorite Iggy Twerk,True,0,135,9957
2109,1527508963.0,24,brisbane,In awe of the size of this lad. Absolute unit.,False,0,425,37787
2110,1527518327.0,11,meirl,meirl,False,0,566,443635
2111,1527518265.0,29,StateOfDecay,I found the best way to improve morale...,False,0,384,15797
2112,1527552064.0,8,HumansBeingBros,Chicago Cubs player giving a fan a new plate of nachos after knocking over their first plate during a diving catch.,False,0,161,565067
2113,1527497541.0,85,unixporn,[i3-gaps][polybar] My first attempt at ricing,False,0,761,104768
2114,1527539368.0,20,Morrowind,ALMSIVI,False,0,90,33254
2115,1527551029.0,5,forwardsfromhitler,"&gt;inb4 ""isnt tumblr all sjws?""",False,0,54,15073
2116,1527521761.0,74,Fuhrerreich,An old comrade has returned to the Soviet Union in 0.2!,False,0,215,2979
2117,1527509458.0,50,logodesign,Logo for a videographer! Can you spot the hidden MB?,False,0,413,44015
2118,1527519401.0,3,Veterans,"Gunny Thomas Sullivan was a two-time Purple Heart recipient from his deployments to Iraq. He was killed on our own soil trying to save the other wounded Marines in the Chattanooga shooting in 2015. He chose to go back when he could’ve easily left. A legendary Marine, and an even better man.",False,0,246,19690
2119,1527524436.0,22,PKA,LOL Good one Chiz!,False,0,285,35322
2120,1527530842.0,40,ChoosingBeggars,I don’t even have the basic skills necessary to do this by myself so I’m gonna need you to do it exactly how I want it.,False,0,297,380372
2121,1527548023.0,0,CrossfitGirls,Mattie Rogers,False,0,56,19196
2122,1527538449.0,6,DogShowerThoughts,Wanting hooman to throw d ball but not wanting to give hooman d ball. Bamboozled decisionz,False,0,91,38440
2123,1527525844.0,26,imaginarymaps,Map of Post-WWII Europe (Western Red Tide),False,0,261,70678
2124,1527550810.0,13,MapPorn,Relief map of western United States,False,0,168,470563
2125,1527544548.0,1,hmm,hmm,False,0,70,22414
2126,1527511048.0,10,thanosdidnothingwrong,The only beer for Thanos,False,0,819,80398
2127,1527518388.0,23,boardgames,I printed custom baby-themed Codenames cards to play with at a friend's baby shower,False,0,258,652867
2128,1527521200.0,156,pics,Personally engraved lighters,False,1,6246,18677625
2129,1527537551.0,40,minimalism,Even minimalists can lose things,False,0,97,297888
2130,1527549554.0,77,rockets,[Charania] Houston Rockets star Chris Paul will miss Game 7 of the West Finals with strained hamstring.,False,0,114,28350
2131,1527520163.0,25,tea,My tea stuffs! Nearly every piece has a story too.,False,0,235,115509
2132,1527521140.0,46,ENLIGHTENEDCENTRISM,Real ‘truth’ hours. Woke tweet,False,0,221,5761
2133,1527517999.0,7,spongebob,I will always remember this war hero...,False,0,265,43864
2134,1527522074.0,45,gifs,Retired man builds train to take rescued stray dogs on adventures,False,1,3579,16159243
2135,1527535189.0,8,surfing,Foam ball livin' somewhere in Peru,False,0,109,49717
2136,1527534128.0,32,rpg,John Harper says none of the stretch goal money went to stretch goal authors,False,0,116,239353
2137,1527526712.0,5,Rihanna,My god,False,0,164,13055
2138,1527541209.0,15,BadMensAnatomy,Thirsty?,False,0,80,8834
2139,1527549107.0,10,GifRecipes,Honey-Glazed Bacon-Wrapped Chicken,False,0,121,915544
2140,1527529289.0,39,TopMindsOfReddit,"""This is beyond disgusting!...The child/pedo accusation is not funny and no joking matter. It can ruin people's lives.!"" Top Mind in /r/Greatawakening says without any irony whatsoever",False,0,219,86452
2141,1527473056.0,188,gatekeeping,From BuzzFeed Snapchat,False,2,10495,283386
2142,1527518834.0,570,funny,I made dis and I hope it makes you laugh.,True,7,26352,19595998
2143,1527542716.0,3,weezer,Good to see our man Rivers has his pride in check,False,0,77,11733
2144,1527533498.0,4,DankMemesFromSite19,Sheen has decreed it,False,0,178,21660
2145,1527546804.0,6,theocho,A World Championship of Cigar Box Juggling should be a thing,True,1,94,226837
2146,1527545836.0,9,virtualreality,"Beat Saber sold 100,000 copies in less than a month!",False,0,64,55311
2147,1527522302.0,15,ThatPeelingFeeling,"Saw a guy in another phone store open a phone without peeling it. Decided to finish what he couldn’t. (Sorry for putting my finger on the back, i know i’m a disgrace.)",True,0,208,49185
2148,1527502552.0,41,formula1,Ocon trolls Will Buxton at the Monaco post-race Paddock Pass,False,0,1257,356966
2149,1527532570.0,6,ShitRedditSays,[EFFART] Video has a woman in it. Reddit reacts.,False,0,124,106511
2150,1527552675.0,3,thisismylifenow,We got him a kitten. He doesn’t care.,False,0,72,448499
2151,1527514454.0,28,custommagic,Fluffy Bunny,False,0,314,12008
2152,1527528301.0,10,Ghostbc,Me and my partner at the STL ritual last Friday,False,0,161,14147
2153,1527516825.0,7,croatia,Standardno....,False,0,279,33690
2154,1527505915.0,23,shield,"In celebration of 5 amazing seasons I drew some fan art of the show, I hope you like it.",False,0,717,77945
2155,1527508484.0,43,BatmanArkham,Croc in AK is scarier than Asylum or City hands down *shudder*,False,0,427,24395
2156,1527535389.0,34,Blink182,Not Now,False,0,104,23498
2157,1527535376.0,8,Drizzy,always saw you for what you could have been,False,0,108,12796
2158,1527513178.0,141,NASCAR,"TOYOTA plans to introduce the Supra to Xfinity series, sources say",False,0,336,91371
2159,1527508620.0,18,mildlyinfuriating,Are you kidding me. Why have a carpet like that if you can’t put it in the middle 🙃,True,0,1406,957601
2160,1527518838.0,10,YuzuMiko,♥ FREE HD TAMAMO MAID REGULAR AND LINGERIE FOR EVERYONE! [~ 80 photos] ♥ ~ by Mikomi Hokina,False,0,249,9927
2161,1527528745.0,26,PoliticalHumor,Does this man have a go fund me page? I’d be willing to donate!,False,0,1049,387159
2162,1527544774.0,0,VillagePorn,"Puerto Bertrand - Aysén, Chile [OC] [5970 × 3773]",False,0,70,60185
2163,1527518526.0,107,nintendo,"Wulverblade sells significantly (3x) more on Switch than PS4, Xbox One, &amp; Steam combined",False,0,370,528245
2164,1527525690.0,5,DMDadJokes,What kind of stories are told in the Seelie Court?,False,0,174,29021
2165,1527502971.0,71,science,"In a new nationwide study of more than 300,000 adults, a Yale-led team found that people who live in communities that offer racial diversity, access to preventive health care, and public transportation, among other elements, are more likely to report high levels of well-being, the researchers said.",False,1,822,18729514
2166,1527514755.0,11,Cinemagraphs,"I'm a firestarter, twisted firestarter",False,0,453,389048
2167,1527528172.0,2,SuperMega,Lovin’ the thumbnail boys!,False,0,152,10313
2168,1527539106.0,5,Frisson,"[Text] YouTube comment sections are typically the worst of humanity, but the consistency and tone of this particular video's comments hit me pretty hard",False,0,88,164669
2169,1527523354.0,23,Logic_301,[Fresh Video] Logic’s Absolutely Crazy 3:18 Freestyle at Soundset,True,0,195,13551
2170,1527532467.0,8,pettyrevenge,Sure I'll let you know when Dad's home,False,0,266,400844
2171,1527541184.0,0,kpics,Irene,False,0,116,29957
2172,1527493161.0,34,2meirl4meirl,2meirl4meirl,False,0,6802,358630
2173,1527518045.0,85,BuyItForLife,[Request] BIFL Wool Blanket,False,0,261,454476
2174,1527505015.0,17,StreetFighter,The Wolf of Metro City,False,0,507,64593
2175,1527548226.0,6,doommetal,Sleep in London,False,0,57,18463
2176,1527542655.0,12,touhou,Get to Know the Girls of Touhou 7!,False,0,74,19619
2177,1527529756.0,52,EARONS,Cruising through my old neighborhoods in Citrus Heights.,False,0,142,22837
2178,1527536032.0,27,lacrosse,Congrats to Yale on their first Championship,False,0,100,15005
2179,1527525841.0,10,Military,"My Brother, Sgt. George A. Mitchell Jr. K.I.A. Baghdad, Iraq 04-07-03",False,0,250,137158
2180,1527535256.0,10,DragonballLegends,every single time,False,0,106,15001
2181,1527530960.0,13,WWEGames,WWE 2K19 Custom Cover: AJ Styles,False,0,131,20700
2182,1527495312.0,65,Philippines,Accurate af,False,0,836,148562
2183,1527542263.0,15,sandiego,"Something I observed earlier today... Don't know where else to post it, so I'll post it here as a PSA.",False,0,73,51740
2184,1527542511.0,11,JUSTNOFAMILY,"On Mother's Day, my mom offered me Xanax.",False,0,74,35189
2185,1527549896.0,6,knives,NKD! My wife and I decided on new knives during our vacation!,False,0,53,122538
2186,1527513491.0,160,investing,How does a young person with little financial knowledge get started?,False,0,329,526294
2187,1527509946.0,31,AFL,Tiny Heath Shaw uses magic to summon Heath Shaw to intercept Zach Merrett's hand pass.,False,1,390,31557
2188,1527476423.0,38,NotMyJob,Nananananana spider man,False,0,3767,348620
2189,1527512616.0,592,MemeEconomy,invest?,False,0,1094,534669
2190,1527521720.0,36,asktransgender,insurance approved my FFS and SRS!! 💖💖💖,False,0,212,64033
2191,1527546624.0,5,future_fight,best card in the game,False,0,60,22354
2192,1527524602.0,50,IWantToLearn,I want to learn how to have a good trip. I want to learn how to have a psychedelic trip confidently. I want to make sure I am not going to have psychosis or become schizophrenic.,False,0,184,351911
2193,1527529009.0,21,labrats,Happy Memorial Day to me!,False,0,144,25834
2194,1527521664.0,32,smoking,"First batch of the day, each grate has 4 Racks.",False,0,212,58561
2195,1527545591.0,18,badmathematics,1=2 EXPLAINED,False,0,63,15372
2196,1527541607.0,13,BattleRite,I know circle hitboxes are weird in this game but wtf is this?,False,0,79,47176
2197,1527520298.0,2,TaylorSwiftsLegs,Can't get over this look,False,0,225,18904
2198,1527504896.0,8,medicalschool,I'll definitely get to it tomorrow... [Shitpost],False,0,732,75760
2199,1527534162.0,1,ProEDmemes,Scariest halloween costumes ever 💀,False,0,112,8095
2200,1527536261.0,9,realmadrid,This picture of Zidane is perfect,False,0,150,25118
2201,1527524546.0,2,slimerancher,I'm surprised to be the first to have though about it,False,0,179,11160
2202,1527516589.0,41,dauntless,BEST Dauntless Guide I've Seen.,False,0,401,26591
2203,1527506391.0,65,Health,"42,000 Americans die each year of opioid overdose. Government looks the other way.",False,0,466,300955
2204,1527526462.0,0,awesome,Antique -acrylic/ink,False,0,161,100073
2205,1527511998.0,16,USMC,"RIP guys, hard to believe its been almost 11 years.",False,0,504,27458
2206,1527535500.0,43,NintendoSwitchDeals,Just picked up some switch games and controllers for 50% off at TRU in MN. Tons of stock left but the place was busy. Picture for proof! Good luck,False,0,103,54624
2207,1527530589.0,34,vegan,“We need to stop global warming but I refuse to make tough choices” Starter Pack,False,0,291,193973
2208,1527523722.0,23,ImageStabilization,4-year old child is saved from balcony fall by passer by in Paris [stabilized],False,0,187,36479
2209,1527544177.0,2,DarwinAwards,Potential Candidate,False,0,67,16106
2210,1527517158.0,19,balisong,"Mods are asleep, upvote clones",False,0,264,13580
2211,1527538770.0,14,China,Hundreds march in Hong Kong to mark Beijing's deadly Tiananmen crackdown | The Japan Times,False,0,89,65622
2212,1527533488.0,2,TuxedoCats,"Weasel and his new sister, Boo Bear",False,0,114,10291
2213,1527542397.0,25,ActionFigures,When you spend like 45 minutes posing toys.,False,0,106,20665
2214,1527540393.0,28,gunpolitics,"Judge proposes kitchen knives be filed down, to help with knife violence",False,0,82,23524
2215,1527522645.0,58,legaladvice,Neighbours spying on me (F) with drone!,False,0,430,413422
2216,1527538082.0,1,hoggit,"""Three's out."" Wishing Everyone a Special Memorial Day.",False,0,90,13754
2217,1527538995.0,8,Kirby,A productive day in class.,False,0,130,13806
2218,1527485376.0,96,sweden,Vad gör du när du sitter på tåget?,False,0,2048,201949
2219,1527527928.0,25,Cricket,Shout to Zaheer Khan!,False,0,152,71614
2220,1527506237.0,9,hearthstonecirclejerk,Nat Pagle. UpBomb this so when people search for Nat Pagle this shows up.,False,0,452,16470
2221,1527551148.0,0,boop,Close up for the boop,False,0,46,48323
2222,1527512568.0,74,whatisthisthing,Found in an old Czech house,False,0,724,560700
2223,1527529326.0,24,functionalprint,Now my big head can fit hats finally. Hat snap extension.,False,0,208,48961
2224,1527540556.0,8,TheSimpsons,Rest in Peace Phil Hartman,False,0,174,212804
2225,1527521326.0,45,weightlifting,Japanese thicc boi lifts stuff,False,0,211,50732
2226,1527508774.0,77,startrek,TIL Alexander Siddig is the nephew of Malcolm McDowell,False,0,404,160850
2227,1527522160.0,3,GODZILLA,..Tokyo is magical,False,0,203,21566
2228,1527518535.0,21,ShinyPokemon,[7] Finally! Lowest sos was 18 for vaporeon highest was 2283 for sylveon,False,0,246,23782
2229,1527521948.0,25,Guitar,[PLAY] Gojira - Heaviest Matter of the Universe. (Metal),False,0,209,369786
2230,1527495533.0,399,buildapc,My dumbass may have ruined my 2000 computer,False,0,787,919630
2231,1527534899.0,15,DeepFriedMemes,"Like come on, be original.",False,0,502,327329
2232,1527522112.0,25,EnoughMuskSpam,Most important person,False,0,200,10962
2233,1527522899.0,5,TownofSalemgame,When you finish writing your spy will with 4 RM but vig shoots you,False,0,193,22574
2234,1527512753.0,11,TwoSentenceHorror,"Running through the battlefield, I slaughtered my enemies with merciless enjoyment.",False,0,332,26404
2235,1527533981.0,6,UnexpectedThanos,As all things should be,False,0,109,5538
2236,1527508822.0,37,Entrepreneur,"Here's the process I use to come up with available domain names for my side-gigs, using things like colours, animals and rhymes to find something unique. These techniques can also help you with branding if you don't have budget for an agency",False,0,397,413277
2237,1527531135.0,1,elizabethzaks,Selfie,False,0,128,16667
2238,1527522942.0,16,PlantedTank,First tank. One month old. Still going through the learning curve but I love it.,False,0,192,50710
2239,1527529825.0,35,Badfaketexts,A true conversation between intellectuals 🤔,False,1,297,170592
2240,1527525209.0,11,dogswithjobs,Today we also remember our four legged heroes.,False,0,253,217630
2241,1527507356.0,12,Birbs,hungryhungrybirb,False,0,631,82655
2242,1527541121.0,28,rpdrcringe,Throwback to Robbie lying about baking a fancy pie,False,0,76,5053
2243,1527554148.0,9,freebies,"Free Golden Road Brewing Keychain for first 20,000. Info in comments.",False,0,48,585296
2244,1527533448.0,28,starterpacks,"The '10,000 BC Fuck Boy' Starter Pack",False,2,787,485116
2245,1527535908.0,7,devils,An early Christmas present from a family friend.,False,0,98,12791
2246,1527530718.0,13,shoringupfragments,9 Levels of Hell - Part 62,False,0,127,5324
2247,1527515190.0,1099,news,"Butchers 'living in fear' as vegan attacks on the rise, says Countryside Alliance",False,3,2040,16069449
2248,1527526161.0,12,FortniteBattleRoyale,Thank you for all the hard work Epic,False,0,236,55601
2249,1527516274.0,22,HelloInternet,That's one way to deal with freebooters,False,0,273,36387
2250,1527539555.0,3,Lovecraft,“Requiem” on Netflix,False,0,83,57788
2251,1527515487.0,1046,AskReddit,What basic activity would be a hilarious Olympic sport?,False,0,2004,19279557
2252,1527530373.0,6,flightsim,A Dreamy Virgin,False,0,129,31661
2253,1527521618.0,3,Cyberbooty,Samus by Sean Tay,False,0,203,16279
2254,1527535997.0,6,beards,Professor Badass in the making.,False,0,143,150691
2255,1527534369.0,22,youtubehaiku,[Poetry] Flight of the Bumblebee on 101 Bottles!,False,0,337,699994
2256,1527507709.0,9,arcticmonkeys,It's called Shiteposting for a reason,False,0,623,28685
2257,1527534466.0,4,ToiletPaperUSA,Charlie explains how to determine someone gayness levels.,False,0,107,8131
2258,1527540454.0,8,SWORDS,Bronze age sword,False,0,78,20142
2259,1527536790.0,14,PewdiepieSubmissions,ItsSkyLOL vs Boobiestreamers,True,1,491,343118
2260,1527536452.0,2,blop,HD focused blop,False,0,207,82332
2261,1527522936.0,10,ArianaGrande,Glits and Glamour! (MIC),False,0,190,35578
2262,1527536788.0,1,Detroit,Ambassador Bridge and Detroit Skyline at Sunrise this morning from the foggy river.,False,0,96,26364
2263,1527520077.0,2,cosmoandwanda,Headphone cords. I’m not fooled.,False,0,219,18329
2264,1527515978.0,7,SuddenlyGay,No homo,False,0,404,120907
2265,1527516322.0,19,JonTron,"Jon should wear a cape, then get himself a staff",False,0,396,79158
2266,1527544463.0,4,ArchitecturePorn,"Museo Soumaya - Art museum in Polanco District, Mexico City, Mexico [OC] [2448 x 3009]",False,0,96,212236
2267,1527525833.0,79,bostonceltics,[D’Amico] Danny Ainge says Gordon Hayward is starting to play one-on-one and should be back to playing basketball in the next 1-2 months.,False,0,355,52180
2268,1527544884.0,3,Serendipity,I FINALLY FOUND A FRIEND WHO IS AS INTO GRILLING AS I AM [X-Post From /r/totallynotrobots],False,0,64,47895
2269,1527515912.0,8,animenocontext,[Oreimo 2],False,0,272,31165
2270,1527532293.0,1,TheTempleOfOchako,OCHAKOOOOO,False,0,120,3351
2271,1527531903.0,11,NLSSCircleJerk,lionNUT,False,0,264,29205
2272,1527533798.0,1,OffensiveMemes,"The Pikachu of ""peace""",False,0,160,60256
2273,1527535680.0,3,ChurchofKawakami,One Smol Sadayo,False,0,99,2809
2274,1527525786.0,55,Gamingcirclejerk,We all knew this was coming sooner or later,False,0,247,64416
2275,1527532988.0,13,gardening,Got some mystery columbine seeds last year. A year later I got to see if they were worth the wait.,False,0,371,647964
2276,1527542999.0,4,mgmt,When the stereo sounds strange so you hide but it doesn’t go away,False,0,71,5145
2277,1527542996.0,15,MarvelStrikeForce,Battling Blitz trash when suddenly..,False,0,69,21915
2278,1527540048.0,43,vancouver,Surrey Creep Catcher Ryan Laforge sentenced for pair of assaults | CBC News,False,0,118,82749
2279,1527548830.0,3,adventuretime,A few AT doodles,False,0,81,180344
2280,1527536830.0,8,Dragonballsuper,Gohan vs cell. What do you think of this one?,False,0,92,19589
2281,1527529985.0,2,BorderCollie,"Meet Dexter, he turns 1 year old next month!",False,0,132,12490
2282,1527510537.0,35,familyguy,consuela privacy sign,False,0,367,118180
2283,1527539788.0,9,LateStageCapitalism,"We've reached the ""prison buses with baby seats"" stage of capitalism.",False,1,178,295595
2284,1527539752.0,6,forsen,"Bajs, need some help to retweet/like this post by Krakenbul",False,0,80,18466
2285,1527530715.0,24,phoenix,LPT: Beat the heat in your car! Don’t remove the sunshade when you’re driving.,False,0,127,33240
2286,1527475979.0,98,lotrmemes,In honor of our alliance.,False,2,6079,66444
2287,1527521911.0,8,Watercolor,"Top of the World (&lt;park) at Laguna Beach, CA: 20x20""",False,0,199,35278
