,created_utc,num_comments,subreddit,title,is_video,num_crossposts,score,subreddit_subscribers
0,1527540246.0,200,blackpeoplegifs,Destiny calls,False,4,14867,327189
1,1527537230.0,3113,MemeEconomy,This format can work for a variety of things. A smart invest indeed!,False,7,38179,534642
2,1527540516.0,224,StarWars,So I got married last night...,False,1,12216,881134
3,1527538280.0,1321,pics,"This guy holding an umbrella over a soldier standing by the seat and plaque dedicated to the 92,000+ unaccounted for American soldiers since WWI",False,6,32034,18677607
4,1527535840.0,597,nostalgia,The family computer,False,1,25514,408323
5,1527536902.0,642,todayilearned,"TIL that when they tried to book a phone call from the President to inform Sgt Dakota Meyer that he had been approved for the Medal of Honor, White House staff were told he was working a construction job and to call back during his lunch hour.",False,2,19248,18824535
6,1527532672.0,692,gifs,Nice trick,False,15,55665,16159230
7,1527532025.0,492,aww,A bit overprotective,False,10,63431,17192415
8,1527536392.0,870,FortNiteBR,At this moment RiceGum knew he fukt up. His hand is off the controller but not on the hand cam. This post is late but better late than never.,False,1,19590,645998
9,1527537936.0,477,funny,The Perfect Man,True,3,10020,19595965
10,1527530907.0,396,mildlyinteresting,My girlfriend’s cat paces using the same steps each day,False,4,35243,14305746
11,1527533336.0,310,memes,Numbuh 1,False,2,22223,1148982
12,1527535623.0,229,gaming,Apparently those Rocket League skills weren't all for nothing,False,1,11365,18169462
13,1527533986.0,220,Showerthoughts,Identical twins could make a ton of money if one purposely got fat while the other got buff. They'd make a killing selling before and after photos for weight loss advertisements.,False,0,19217,14122612
14,1527535454.0,302,cringepics,Debbie downer on a post about a recently sold house,False,2,9017,921544
15,1527531076.0,155,AnimalsBeingBros,"Hey Human, Want a Treat?",False,3,20551,902858
16,1527539137.0,322,sports,Boston's Jackie Bradley Jr. makes an over-the-shoulder leaping catch,True,2,7178,13375758
17,1527533520.0,81,BeAmazed,"Illuminated tunnel in Mei, Japan",False,3,11674,598049
18,1527537762.0,273,news,"5,000 military dogs went to Vietnam; not a single one came back. Now there is a memorial to honor them.",False,1,6281,16069431
19,1527531878.0,504,marvelstudios,Masks and helmets in the MCU are on another level of awesome,False,2,15496,402100
20,1527527000.0,448,instant_regret,He just barely touched his tail,True,14,20993,937291
21,1527535387.0,38,AnimalsBeingJerks,Making the most out of a bad situation,False,0,6497,966465
22,1527524927.0,263,WhitePeopleTwitter,Poor Nigel,False,1,30012,514408
23,1527536042.0,74,Simulated,[OC] Blocky tornado.,True,0,5776,243188
24,1527527003.0,172,nonononoyes,That landing though,False,5,13858,850999
25,1527525023.0,242,oddlysatisfying,My cake...purple reflective donut.,False,3,21991,1650172
26,1527530589.0,240,justneckbeardthings,*tips fedora at you*,False,2,9564,380786
27,1527543973.0,168,Whatcouldgowrong,Crossing the street on a Cellphone during a greenlight. WCGW?,False,0,3109,1149610
28,1527524677.0,798,OldSchoolCool,my mom's middle school custodian 1980,False,0,19254,12850197
29,1527532094.0,698,funny,When they ask you about the dress code.,False,8,35189,19595966
30,1527525195.0,342,BlackPeopleTwitter,Old HObits die hard...,False,0,30711,1723212
31,1527531135.0,277,NintendoSwitch,"(E3 Hype) It's a long shot, but i'm hoping Animal Crossing Switch gets announced this year - so I drew some fan art!",False,0,7491,617678
32,1527543128.0,98,gameofthrones,[NO SPOILERS] Violet eyed Daenerys,False,0,2995,1328096
33,1527539550.0,45,greentext,Mods are asleep. Heres this.,False,0,4632,372628
34,1527534130.0,751,europe,"Answer to ""It is nice to be here in Eastern Europe!""",False,0,5455,1721183
35,1527527045.0,61,wholesomememes,[OC] The joy of painting.,False,2,11766,1483174
36,1527529838.0,180,surrealmemes,THEYЯE HΞЯΣ,False,2,9498,312714
37,1527520610.0,1717,worldnews,European Union moves to ban single-use plastics.,False,2,44334,18764538
38,1527525545.0,171,HistoryMemes,"""It's all Germany's fault""",False,2,12987,142202
39,1527525740.0,429,INEEEEDIT,Pretty durable solar panel charger,False,0,11491,372696
40,1527525506.0,366,FoodPorn,Steak and Eggs wrapped with a fried cheese shell [925X960],False,1,11433,920690
41,1527526168.0,45,BikiniBottomTwitter,"oh no, not again",False,1,11255,687202
42,1527534115.0,2102,pics,Let us never forget.,False,8,64744,18677608
43,1527529160.0,85,OSHA,Using newspaper as a welding mask,False,0,6475,464886
44,1527522440.0,98,TheLastAirbender,New Yip...,False,3,19484,238229
45,1527545580.0,140,interestingasfuck,Impressive First Nations tattoo Reveal,False,1,2456,2169561
46,1527519951.0,464,MovieDetails,"Terminator 2 (1991) had some practical effects with the help of Linda Hamilton's twin sister. When Sarah cuts a hole in T-800 head it's a model of Schwarzenegger’s head in the foreground, the real Schwarzenegger plays his own reflection, and Linda’s twin sister mimics her moves",False,3,29702,657609
47,1527526272.0,395,PrequelMemes,"A surprise to be sure, but a welcome one",False,0,11581,598007
48,1527533949.0,1441,FortNiteBR,New updates/ rideable shopping carts,False,1,17811,645999
49,1527523331.0,5866,AskReddit,What did your parents allow you to do that you would never allow your own children to do?,False,0,14071,19279524
50,1527522905.0,57,boottoobig,"Roses are red, don't hate on linguine,",False,1,13838,326994
51,1527536808.0,72,creepy,I drew that creepy skull that was posted here a few days ago,False,0,3993,12212358
52,1527530249.0,214,gifs,My friend went to the everest basecamp and sent me this!,True,1,13320,16159229
53,1527520139.0,489,DunderMifflin,I met a heart surgeon while shopping,False,1,37489,554010
54,1527520641.0,596,MMA,An accurate summary of the Till vs. Thompson fight,True,0,13880,531157
55,1527520071.0,445,BetterEveryLoop,This is majestic.,False,14,34393,689195
56,1527531461.0,646,books,I know I'm late to the party but Terry Pratchett is brilliant.,False,0,4706,14572516
57,1527534933.0,412,CringeAnarchy,And The Worst Twitter Account Of The Year Goes To...,False,0,4017,348264
58,1527520548.0,438,LateStageCapitalism,truly a mystery,False,2,16663,295594
59,1527520319.0,577,educationalgifs,How a fire sprinkler works,False,3,18220,601791
60,1527532725.0,32,confusing_perspective,When you catch her looking at you,False,0,4373,229711
61,1527518099.0,345,woahdude,Timelapse of a 3D printed iris box,False,3,20931,1787087
62,1527537686.0,660,LiverpoolFC,Fabinho confirmed,False,0,2872,96774
63,1527519594.0,165,disneyvacation,How to Cope When You're the Only One Who Realizes Gazebos Are Stupid,False,1,14418,277000
64,1527519565.0,3627,mildlyinfuriating,"The hospital ""helping""",False,11,47305,957582
65,1527535062.0,130,starterpacks,The little shithead starter pack-girl version,False,0,3568,485110
66,1527539851.0,18,Eyebleach,MINE!,False,0,2581,855431
67,1527539566.0,29,rarepuppers,3-legged pupper super happy to finally have an official home!,False,0,2649,651775
68,1527524475.0,696,gaming,Trying to make friends as an adult,False,2,36177,18169462
69,1527523614.0,61,holdmybeer,HMB while I limbo this barrier,False,2,7116,710635
70,1527532379.0,106,totallynotrobots,I THINK I WILL FINALLY BE GETTING A PET,False,0,3801,268660
71,1527534194.0,38,oldpeoplefacebook,Another gem from Deborah,False,0,3409,603977
72,1527537922.0,19,woof_irl,Woof🍴irl,False,0,2720,198695
73,1527517960.0,1012,space,Hope that in our lifetimes and not when we're super old that we can witness the first manned Mars landing the same way the world watched a man land walk on the moon.,False,1,18731,13860031
74,1527532958.0,16,combinedgifs,Fashionista,False,0,3497,325661
76,1527520998.0,41,Thisismylifemeow,Catfishing,False,1,9648,119845
77,1527516804.0,10546,movies,"Box Office Week - Solo: A Star Wars Story debuts at #1 with a worrisome $83.3M domestic on an estimated budget of $250M-$300M. Worldwide it's even worse as the film debuted to a disastrous $65M international, less than what Deadpool 2 made internationally on its second weekend.",False,0,34084,17613084
78,1527520539.0,76,PeopleFuckingDying,TuRtLe FucKInG DemoLisHeS PeRsoNs HeaRT,False,1,12479,681704
79,1527514996.0,168,comics,musical plants [oc],False,2,29115,923302
80,1527529857.0,209,LifeProTips,"LPT: If an ad on YouTube is unskippable and long, you can tap the (i) in bottom left hand corner, then ""stop seeing this ad"", then choose irrelevant, repetitive, or inappropriate (all work). It will end immediately and earlier than if you had watched the entire ad.",False,1,4452,14128617
81,1527530339.0,73,thalassophobia,Imagine yourself walking out to take this photo.,False,0,4102,293406
82,1527522324.0,376,JusticeServed,"Apollo 14 astronaut Ed Mitchell literally kicks the ass of a moon landing denier who uses forged History Channel credentials to enter his home, ambush him, and call him satanic in front of his kid",False,0,8199,404331
83,1527524025.0,425,news,94-yr old WW II veteran gets high school diploma 74 years after dropping out to serve,False,3,36616,16069430
84,1527521774.0,3674,trashy,Thought this belonged here.,False,4,48711,733809
85,1527518792.0,191,EmpireDidNothingWrong,Its true,False,2,16223,270044
86,1527516580.0,553,ProgrammerHumor,3 Steps to enjoy life,False,3,15377,532026
87,1527517683.0,392,youseeingthisshit,Not today,False,6,24030,496927
88,1527536533.0,63,PewdiepieSubmissions,REEEEEEEEEEEEEEEEEEE,False,0,4475,343105
89,1527538742.0,41,wholesomememes,What getting a guitar from your favorite band feels like,False,1,4257,1483174
90,1527543517.0,52,PoliticalHumor,A presidential Memorial Day message,False,0,1880,387159
91,1527524212.0,223,ChoosingBeggars,"Never thought I'd post here but, how does 1$ a design sound?",False,0,5732,380371
92,1527518002.0,294,geek,Making a knife from Lignum Vitae wood,False,5,10479,458088
93,1527516510.0,82,AccidentalWesAnderson,Hong Kong Playground by Ludwig Favre,False,0,11555,231520
94,1527533426.0,21,MadeMeSmile,Cat walk!,False,0,3005,612873
95,1527540219.0,87,ComedyCemetery,Adam finally went back and edited the speech bubble out of his Loss comic,False,0,2035,289999
96,1527528541.0,177,pics,"""This one opened too!""",False,3,17418,18677607
97,1527524240.0,65,DeepFriedMemes,Y'all heard des🅱acito 2 yet?,False,0,7703,327322
98,1527515912.0,739,Futurology,Oil industry is finally starting to be affected by Norway’s rapid electric car adoption,False,3,19063,13024327
99,1527513723.0,183,PandR,Be as positive as Chris Traeger.,False,4,19873,269651
101,1527519771.0,932,todayilearned,"TIL that oregano was practically unheard of in the U.S. until American G.I.s in WWII returned from Italy with a taste for the ""pizza herb""",False,1,29241,18824535
102,1527515707.0,345,Bitcoin,There are 180 different scenarios where bitcoin go. If any one thing happens remember me i am the first one to predict this,False,3,13929,842816
103,1527540640.0,56,interestingasfuck,Skiing over the water,False,1,3089,2169561
104,1527523772.0,553,videos,$1.3Million Paving Machine sits idle in a Los Angeles lot while a homeless man uses it for shelter.,False,4,5088,17791016
105,1527515423.0,330,food,[Homemade] Seared Duck Breast,False,2,21004,13337635
106,1527526724.0,53,breakingbad,For those who are in a rush.,True,2,4133,390731
107,1527535537.0,49,AbandonedPorn,QWERTY in Creek - Huntsville AL [998x998],False,1,2413,613130
108,1527518686.0,172,anime_irl,anime_irl,False,0,8257,241770
109,1527520179.0,421,IAmA,"IAmA science journalist who has spent the past year visiting every lab that has discovered a chemical element since 1945. I've traveled 60,000 miles and I still goof about around particle accelerators. AMA.",False,0,6721,17994378
110,1527520018.0,44,CatSlaps,"""Hey! Occupied!""",False,5,6331,99801
111,1527527127.0,42,southpark,"""Why don't we just shoot him?""",False,0,3838,375464
112,1527514668.0,193,KenM,Ken M on the Bible,False,0,12933,438685
113,1527512220.0,855,EarthPorn,"Just a cloud and a hill, Italy (OC)[1920x1920]",False,7,44967,15314454
114,1527517439.0,82,2healthbars,Unbearable,False,3,8658,188881
115,1527516859.0,51,youdontsurf,Game night ruined,False,0,8471,346066
116,1527531904.0,83,specializedtools,This tool makes fake brick print,False,0,2844,198570
117,1527517799.0,30,hardcoreaww,"Can I help you? If you are looking for my mom, she already knows you're here",False,0,8046,174578
118,1527512521.0,473,HighQualityGifs,Cows watching yoga.,False,4,37039,835295
119,1527525280.0,612,aww,Couple with Down's syndrome celebrate 22 years of marriage.,False,2,48230,17192417
120,1527531567.0,31,BeforeNAfterAdoption,He went from dumpster kitty to king of the castle.,False,0,2794,160414
121,1527524941.0,124,canada,Canada's House of Commons adopts motion to formally enshrine net neutrality into law,False,1,3994,368285
122,1527534936.0,98,FellowKids,[Meta] This sub in a nutshell,False,0,2357,348456
123,1527523082.0,285,DiWHY,Bathing season,False,0,4829,355027
124,1527525913.0,867,funny,Dave Bautista has achieved full Drax.,False,3,63960,19595965
125,1527530255.0,44,CrappyDesign,Run! The Children are Attacking!,False,0,3128,1032659
126,1527512154.0,422,quityourbullshit,The Human Watch Speaks,False,6,20619,698251
127,1527539127.0,30,zelda,"""Finally got around to playing this""",False,0,1748,395773
128,1527509512.0,1059,HumansBeingBros,Appreciation and gratefulness.,False,1,46394,565060
129,1527526932.0,143,teenagers,We are teens,False,0,4111,499900
130,1527527071.0,43,Damnthatsinteresting,The Statue of Liberty's Shadow,False,0,3734,724825
131,1527520299.0,105,crappyoffbrands,Morge,False,3,6276,280697
132,1527515197.0,123,travel,Our honeymoon view in Santorini,False,0,8404,1025506
133,1527511773.0,94,meirl,me_iRl,False,7,17347,443634
134,1527509820.0,212,AnimalsBeingDerps,Caught in the act,False,6,27404,560172
135,1527521096.0,111,HistoryPorn,"A captured Wehrmacht soldier identifies an SS trooper as one those who shot US Army prisoners in Malmedy, Belgium, during the “Battle of the Bulge”. These men were captured by the 3rd US Army near Passau, Germany.1945.[1000x758]",False,1,4804,936857
136,1527512221.0,586,OopsDidntMeanTo,Oopsie,False,4,19166,455229
137,1527523753.0,49,dogpictures,Aaaand she's 19. HAPPY BIRTHDAY!,False,0,4188,208832
138,1527534942.0,55,antiMLM,Why do they target us?,False,0,2082,156709
139,1527528351.0,267,askscience,Does radioactive decay reduce an object's mass?,False,0,3053,15494843
140,1527510394.0,351,photoshopbattles,PsBattle: Turtle eating strawberry,False,5,31008,13171946
141,1527532253.0,150,Music,AMERICA F*#K YEAH! - Team America World Police ['Murica Rock],False,1,2530,16938196
142,1527540668.0,36,slowcooking,Taiwanese Beef Noodle Soup,False,1,1504,573470
143,1527510651.0,120,DesignPorn,Park exhibit,False,4,19306,381540
144,1527519879.0,113,BikiniBottomTwitter,Every time man😢,False,5,13155,687203
145,1527510350.0,918,FunnyandSad,Its more true than sad but I thought it belonged here,False,3,30331,242496
146,1527532581.0,122,youtubehaiku,[Poetry] [NSFW] A day to remember,False,1,2234,699992
147,1527522664.0,82,thanosdidnothingwrong,Ratings perfectly balanced as all things should be,False,0,4618,80392
148,1527513646.0,336,bestof,/u/Not_A_BusDriver explains why censoring offensive history diminishes it's importance of reminding us of past atrocities (and to not repeat them).,False,0,9279,4883455
149,1527525286.0,54,firstworldanarchists,Just buy the cheese,False,0,3486,461730
150,1527521025.0,62,happycowgifs,Baby cow and little girl snuggling together.,False,2,4733,77683
151,1527531961.0,165,teslamotors,There are some things you can only do in a Tesla!,False,1,2266,265207
152,1527525440.0,128,blunderyears,For my 16th birthday I asked for a Looney Tunes cake and a new game for my Gameboy.,False,0,3356,379733
153,1527527078.0,39,PrequelMemes,"Ah, Victory!",False,2,6543,598007
154,1527512212.0,110,itookapicture,ITAP of a sunset through a window,False,3,10492,672988
155,1527512992.0,155,tattoos,"My new calf piece. Artist: Tony Gacci/Blu Gorilla/Charleston, SC.",False,0,9199,1060095
156,1527516672.0,122,DnDGreentext,The DM copies OGLAF,False,1,5749,118771
157,1527519048.0,460,xboxone,"Battlefield V: ""There are no more Battlepacks. Instead, players will be able to choose their rewards directly or through rank up events.""",False,0,4938,741850
158,1527509509.0,216,evilbuildings,This telescope looks like it could be part of The Death Star,False,1,16327,391106
159,1527522629.0,94,GifRecipes,They finally showed us how to make a Good Burger and Ed’s secret sauce from the movie,False,1,3932,915541
160,1527537092.0,71,FortNiteBR,me and my friends when the shopping cart gets added to fortnite,True,1,4911,646000
161,1527506749.0,3446,technology,"Bitcoin backlash as ‘miners’ suck up electricity, stress power grids in Central Washington",False,3,24970,6193492
162,1527528352.0,305,gaming,I need this for my Jedi training!,False,2,8906,18169462
163,1527536085.0,32,holdmycatnip,HMCN while I touch this tail.,False,0,1762,152161
164,1527520689.0,425,mildlyinteresting,"The plane seat in front of me was removed, giving me an abnormal amount of leg room for an economy class seat",False,0,11204,14305747
165,1527535534.0,32,trebuchetmemes,Homemade cardboard trebuchet.,False,0,1935,156302
166,1527521553.0,780,gifs,rapid-fire cigar box juggling (sort of looks like he has 3 hands,False,43,78558,16159230
167,1527529720.0,26,gardening,My blueberry harvest was out of control - we had to split it three ways!,False,0,2500,647947
168,1527535695.0,80,polandball,This Polandball was drawn with a valid license,False,0,1795,408690
169,1527509075.0,166,therewasanattempt,to exercise with a swing,False,4,17912,544085
170,1527532681.0,105,BoJackHorseman,From BoJacks Twitter: “damn it todd i said you can have a a few people over”,False,0,2041,147727
171,1527516991.0,49,PixelArt,Three Bears [JFS] | artist: prettyprettypixels,False,0,5368,113504
173,1527510517.0,254,nevertellmetheodds,that curve,False,0,14869,607322
174,1527510836.0,122,niceguys,Gotta love Prequel Memes.,False,0,13760,473271
175,1527515985.0,73,ShittyLifeProTips,Keep an eye out,False,1,7912,398032
176,1527511113.0,1099,reactiongifs,MRW I make her squirt,False,5,27412,1481928
177,1527517572.0,1028,Showerthoughts,Shows with laugh tracks would be actually funny if the laugh track were replaced with the sound of just one guy laughing hysterically,False,1,46473,14122612
178,1527507271.0,134,dogswithjobs,L A Z Y B O I,False,1,22603,217627
179,1527534933.0,83,creepyPMs,"Good lord above, why me?",False,0,1815,363217
180,1527517256.0,102,Perfectfit,The perfect gap between...!,True,1,6420,320790
181,1527526580.0,83,harrypotter,Matthew Lewis got married!,False,0,2791,431098
182,1527511544.0,445,Unexpected,"Hey, Becky, let's go shopping and meet cute guys!",False,0,13313,1318702
183,1527540002.0,40,chemicalreactiongifs,Smoke disappear instantly with alcohol and fire,True,0,1364,386659
184,1527521671.0,56,wtfstockphotos,HMMMMMMMMMMMMMMMMMMMMMMMMMMMMMMMMMMMMMMMMM,False,0,3964,155444
185,1527539165.0,43,ContagiousLaughter,Pranking grandma,True,0,1423,566904
186,1527512028.0,60,yesyesyesyesno,Slap Happy.,False,3,9525,340082
187,1527513448.0,639,MURICA,God bless America and all those who died to protect her,False,0,15309,263794
188,1527509688.0,279,Art,"Wheres the coffee, digital drawing, 6600x 10200px",False,1,17123,12864013
189,1527505634.0,842,NatureIsFuckingLit,🔥 Camels can eat cactuses! Their cheeks are lined with keratinized cones that protect them from damage called papillae 🔥,False,7,34908,1118313
190,1527531821.0,76,subaru,"My brother passed away and I got his car, I had to give him a shout out today!",False,0,2011,100175
191,1527512502.0,273,thatHappened,And then the train conductor clapped...,False,0,10242,627661
192,1527512132.0,116,coaxedintoasnafu,too real...,False,1,8148,115890
193,1527505532.0,144,dankchristianmemes,Sorry momma,False,0,29100,298296
194,1527516393.0,42,2meirl4meirl,2meirl4meirl,False,0,6129,358625
195,1527519987.0,46,standupshots,If Jesus was alive today.,False,0,4091,366225
196,1527526900.0,44,sadcringe,Top review for evil apples,False,0,2702,311632
197,1527516531.0,219,oddlysatisfying,The way her waistline aligns with the tide!,False,4,32015,1650173
198,1527524593.0,67,loseit,Got told to get a new passport picture.,False,0,2900,849203
199,1527529669.0,45,BlackPeopleTwitter,Y'all really just leveled up,False,0,3457,1723214
200,1527534805.0,215,LivestreamFail,Hyphonix switching to YouTube,False,0,1633,257810
201,1527529375.0,93,DDLC,A short DDLC comic: Existence,False,0,2357,89933
202,1527512443.0,376,dataisbeautiful,"A plot of objects which were found to be ""the most distant object"" by astronomers over time [OC]",False,2,11173,13046589
203,1527517409.0,161,happy,He told me he thought that he would never find love before he met me. Now our wedding is 18 days away💕,False,0,4702,240721
204,1527535083.0,49,marvelstudios,One of these speeds is not like the others...,True,0,2488,402101
205,1527515600.0,223,Marvel,guardian of the galaxy 2 family,False,0,5276,374653
206,1527529747.0,143,rupaulsdragrace,Willam asking Ivanka the real question.,False,0,2209,172780
207,1527510243.0,43,bigboye,Big Tank Puppy,False,0,8520,92997
208,1527512817.0,2399,LifeProTips,"LPT: when your ISP raises your bill, call in and say “cancel service” to the automated operator. You’ll be sent to their retention team with no waiting on hold. They will usually take $10-20 off your monthly bill for a year. I do this once a year.",False,1,52459,14128618
209,1527520728.0,328,mildlyinfuriating,The visible slice of bacon vs. the rest of the package.,False,3,7019,957583
210,1527520306.0,46,NotMyJob,Not so smart water,False,2,3881,348619
211,1527520207.0,17,WhatsWrongWithYourDog,This is Cricket. Sometimes she can't handle the excitement of going to the beach.,False,0,3822,225476
212,1527512104.0,365,iamverysmart,I was blown away by her confidence to the point that I began doubting myself after speaking English for almost 30 years. The kicker? She’s a 4th year medical student.,False,0,7320,688252
213,1527509115.0,158,tumblr,"Robin Williams, Hogwarts professor",False,1,10213,343542
214,1527508003.0,207,Tinder,I Got Rekt,False,0,12874,944268
215,1527510803.0,71,misleadingthumbnails,This hole right in the middle of my kitchen.,False,0,9042,239081
216,1527510227.0,250,holdmyredbull,The stunts in the second half are insane,True,2,8312,239240
217,1527510546.0,56,brooklynninenine,That's not what a vasectomy is,False,0,8577,98885
218,1527514261.0,360,tifu,TIFU By Powerbombing A Girl,False,1,6588,13287289
219,1527528068.0,46,mechanical_gifs,Iris box,False,0,2213,303928
220,1527510767.0,43,CozyPlaces,A cozy room in the Alps,False,3,9718,444322
221,1527513486.0,228,Jokes,Yo mama so fat,False,0,9464,13650863
222,1527508472.0,207,trippinthroughtime,When you a 40 y/o virgin..,False,2,9179,876629
223,1527520765.0,157,creepy,secare,False,2,6713,12212358
224,1527507470.0,653,madlads,Absolute fucking madlad!,False,0,13399,528462
225,1527542204.0,31,OldSchoolCool,"A side by side of my grandfather. The left was one of the last photos taken of him at his 90th birthday, the right is him at 18 in 1943. He was a great man.",False,0,1555,12850199
226,1527506110.0,238,ATBGE,I think this belongs here...,False,3,11464,531485
227,1527515838.0,49,sbubby,Tony Hawk,False,0,4644,72411
228,1527537627.0,31,PUBATTLEGROUNDS,"Battlefeels, Episode 37 - I.. Can... Nearly.... Make It!",False,0,1297,615752
229,1527545508.0,34,awwwtf,Skunk intimidation defense dance caught on night cam [x-post from /r/gifs],False,0,868,148648
230,1527528598.0,25,facepalm,Quality advice tho,False,2,2188,1324952
231,1527510943.0,56,shittyreactiongifs,MRW it's my first day back to work after broken dick surgery,False,0,6770,290020
232,1527505033.0,898,Justfuckmyshitup,Gimme that Elvis caught in a vacuum cleaner.,False,2,14304,343051
233,1527521739.0,77,thedonald,The one true Donald wishes you a happy Memorial Day! 🇺🇸,False,0,3033,23703
234,1527520560.0,224,aviation,Two Ospreys escort the U.S. President's helicopter over New York,False,0,3233,239505
235,1527518686.0,25,suicidebywords,Love is something that finds you,False,0,4060,72443
236,1527505778.0,295,creepyasterisks,Does this count?,False,1,13744,167640
237,1527515550.0,94,lego,MOC Walking Dinosaur,True,0,4497,336633
238,1527506993.0,300,SuddenlyGay,And they were roomates,False,0,14705,120903
239,1527519061.0,26,notinteresting,Star Wars Easter egg,False,0,3644,211083
240,1527527593.0,112,funny,Is this the best face swap or what?,False,0,19115,19595965
241,1527517080.0,362,socialism,"""Socialism doesn't work""",False,0,4456,137828
242,1527527878.0,99,KerbalSpaceProgram,Oh... okay then little guy...,True,1,2035,275401
243,1527538349.0,44,RetroFuturism,Those Zany 50's,False,0,1222,221533
244,1527504701.0,990,television,'True Detective' Season 3 Will be More Like the First Season,False,0,12173,14572984
245,1527517665.0,197,coolguides,All the days in a 90 year life on a single page,False,3,3761,386665
246,1527512253.0,73,AnimalTextGifs,Cows watching yoga. [OC],False,0,5830,264329
247,1527524618.0,1494,pics,"Pakistan: Women Police officers escort man to jail for abusing his daughter, govt made sure only women would escort him to jail.",False,3,37984,18677607
248,1527535077.0,32,savedyouaclick,Woman Rescues Baby Kitten – Soon Realizes It’s Not What It Seems | It's a fox,False,0,1370,463898
249,1527514114.0,95,powerwashingporn,"I was given a Craftsman 2900 PSI power for free because it was ""dead"". It needed a new carburetor, the previous owner let gas sit in it too long. Added a fuel shutoff switch, and... this is my first run with the ""dead"" power washer.",True,0,5012,329748
