,created_utc,num_comments,subreddit,title,is_video,num_crossposts,score,subreddit_subscribers
3013,1527517303.0,38,rpg,"I needed a simple web-based Dungeon Builder, so I decided to code my own",False,0,263,239354
3014,1527542656.0,85,audiobooks,What’s the best audiobook you ever listened to?,False,0,52,39983
3015,1527520374.0,0,EdgyMemes,Relateable,False,0,151,15292
3016,1527532075.0,2,likeus,To get into the shower,False,0,126,363338
3017,1527534439.0,8,Tau40K,Completed Sunshark and friends!,False,0,72,3778
3018,1527485393.0,109,MilitaryPorn,"A U. S. Army paratrooper with the 82nd Airborne Division's 1st Brigade Combat Team fires his M4 carbine at insurgents during a firefight June 30, 2012, Ghazni province, Afghanistan [2100x1395]",False,0,1990,177255
3019,1527539933.0,23,MarkMyWords,"MMW: One great movie, two bad movies, and one aggressively okay miniseries about the Trump presidency will be released in the five years immediately following it",False,0,55,27081
3020,1527530497.0,12,stopsmoking,"43 days, I'm drunk now. But I can clearly see how worthless cigarettes are. It definitely doesn't deserve to be partnered with alcohol or any other drug. Nicotine is out of my life no matter what state of mind I am in. This is a victory. This really is. I'm not missing cigarettes, I hate them.",False,0,88,63677
3021,1527533834.0,0,thomasthedankengine,Older gentleman killed by Thomas,False,0,76,38735
3022,1527536781.0,4,LoveLive,Chika Performing ~,False,0,139,20338
3023,1527541354.0,2,spaceflight,Colonel Donald Peterson (STS-6) 1933-2018. RIP,False,1,50,25050
3024,1527537222.0,8,batman,Kevin Conroy Reveals The Real Reason They Stopped Making 'Batman: The Animated Series',False,0,67,196747
3025,1527530469.0,0,PrettyOlderWomen,"Angela Kinsey , 43 (Angela from The Office)",False,0,89,11470
3026,1527516575.0,100,unpopularopinion,I wish Fortnite would just die already.,False,0,273,66738
3027,1527540967.0,3,proceduralgeneration,Pixel Acrylics,False,0,50,23921
3028,1527538827.0,6,meme,Starbuck's New Free Coffee Policy,False,0,55,86568
3029,1527526641.0,10,GetMotivated,"[Image] tl;dr - ""happiness cannot be taken away by the other, because it is not given by the other""",False,0,239,13076952
3030,1527521428.0,1,ImaginaryColorscapes,Bougie Afternoon by Megan Rose Ruiz,False,0,142,31939
3031,1527527714.0,6,germanshepherds,Nobody I'd rather be spending my birthday with than this handsome pup :),False,0,153,35561
3032,1527512742.0,463,pics,In honor of our canine heroes on Memorial Day,False,1,25243,18677639
3033,1527546949.0,14,GunPorn,"[OC] Range day with my Steyr Aug A3, Zenith Z5RS SBR, and FN PS90 SBR",False,0,61,82727
3034,1527535054.0,8,RLFashionAdvice,My Octane SkyBlue and Pink,False,0,69,12052
3035,1527515432.0,82,frugalmalefashion,"What are the best-value things to buy at a factory store (JCF, GF, etc.)?",False,0,190,535909
3036,1527516315.0,7,steinsgate,[Daily Steins;Gate Fanart #193],False,0,269,19734
3037,1527521078.0,13,RedditCensors,I asked a question about corrupt Reddit mod stories. Woke up today to find all comments directed to my post were mysteriously removed,True,0,143,6609
3038,1527510859.0,7,dadjokes,I found a good bread recipe where I don't have to get my hands messy from mixing it.,False,0,356,803579
3039,1527515820.0,1,evangelionmemes,End of Evangelion,False,0,191,3648
3040,1527539036.0,14,bioniclelego,The most vicious thing you've seen in a while,False,0,56,7498
3041,1527530419.0,44,lakers,Fabolous needs to be hit with a Magic Johnson fine!!!,False,0,129,58481
3042,1527524146.0,23,RedHotChiliPeppers,Any love for the outro of Minor Thing?,False,0,120,23444
3043,1527546941.0,17,lightshope,Just completed a 10-man Deadmines run. It was hilariously fun.,False,0,38,6238
3044,1527530977.0,1,GFRIEND,Yerin: Hi~ *Eye smiles*,False,0,85,4929
3045,1527538666.0,2,BatFacts,New genetic testing has revealed that hoary bats are distinct enough from their fluffy-tailed cousins to warrant their own genus: Aeorestes. The Hawaiian Hoary Bat is also now recognized as a distinct species (Aeorestes semotus) rather than a subspecies of the hoary bats on the mainland.,False,0,60,12992
3046,1527519077.0,47,40kLore,[Legion Spoilers] The Emperor probably told Alpharius/Omegon about Chaos...,False,0,157,31613
3047,1527512856.0,15,Military,In honor of our canine heroes on Memorial Day,False,0,470,137158
3048,1527529941.0,32,dauntless,TIL: Half a year ago Phoenix labs decides to get rid of loot boxes.,False,0,196,26598
3049,1527520958.0,19,pettyrevenge,“Sorry I can’t guarantee I’m going to be there...”,False,0,452,400844
3050,1527533188.0,48,army,And this is why I respect Chick-fil-A,False,0,165,58878
3051,1527542280.0,8,DeepFriedMemes,omg who did this 😂😂😂😂😂😂😂,False,0,338,327332
3052,1527528987.0,8,DaftPunk,"I made this illustration, and printed it 120x80cm",False,0,142,44775
3053,1527526840.0,5,gamindustri,Purple Heart wants that Black Heart pussy,False,0,157,12525
3054,1527510367.0,42,brockhampton,Like this if u think bh should keep Ameer’s verses,False,0,1183,45418
3055,1527534205.0,0,kpics,Irene,False,0,161,29957
3056,1527536886.0,3,drawing,I saw a creepy skull on Reddit so I drew it,False,0,136,335502
3057,1527550990.0,2,bicycling,[New Shoes Day],False,0,49,280086
3058,1527541907.0,23,FORTnITE,"Someone logged into my account from Italy and spent 8k Vbucks, not sure how to reach Epic",False,0,107,177813
3059,1527547714.0,9,WWII,It’s dangerous to go alone.,False,0,81,115533
3060,1527534160.0,39,NASCAR,Jeff Gluck is getting hilariously trolled now by the Reddit police.,False,0,107,91371
3061,1527544532.0,41,gifs,High School kid kicks 51 yard Field Goal with nobody holding the ball,False,0,952,16159253
3062,1527528666.0,30,Vive,"Beat Saber sold 100,000 copies in less than a month!",False,0,144,101699
3063,1527516703.0,10,sadcringe,Good to know,False,1,257,311635
3064,1527546893.0,261,MemeEconomy,New format,False,0,178,534676
3065,1527540567.0,2,UnexpectedMulaney,/r/DisneyVacation isn't immune!,False,0,74,33851
3066,1527537253.0,1,hardcoreaww,Got wool?,False,0,90,174584
3067,1527537465.0,0,ComedyNecrophilia,OC unfunny but useful,False,0,89,31407
3068,1527532291.0,8,Conservative,Caged Migrant Children Photo Goes Viral As Left Rages At Trump; Except It Happened Under Obama,False,0,172,135942
3069,1527524503.0,36,furry_irl,Furry_irl,False,0,375,33186
3070,1527553986.0,1,AccidentalRenaissance,Facebook's a goldmine,False,0,45,381372
3071,1527548708.0,15,australia,Royal Commission: Bankwest seized pub after reducing 13 year loan to 1,False,0,73,218581
3072,1527509899.0,6,RussiaLago,"Trump blatantly attempted to interfere in Mueller probe, MSNBC host explains. Ari Melber discussed how Trump lawyer’s attendance at DOJ meeting was “improper, unprecentended”",False,0,364,38313
3073,1527544154.0,45,freefolk,I love Arya and Daenerys parallels,False,0,101,358998
3074,1527525814.0,120,ZeroWaste,I've noticed a few people being down voted when the topic of eating animals comes up. It's strange to me.,False,0,163,52821
3075,1527545887.0,7,medicalschool,[Shitpost] When I hear someone's not paying for sketchy,False,0,86,75760
3076,1527522642.0,17,vegan,Can anyone relate to this? Story of my life.,False,0,413,193974
3077,1527526640.0,13,NotHowGirlsWork,All women die after they run out of eggs.,False,0,154,29148
3078,1527532049.0,7,AccidentalRacism,So we all know who's allowed to walk around here!,False,0,117,93929
3079,1527471583.0,550,LateStageCapitalism,That awkward moment when you realize that charging interest (usury) is forbidden in the bible and considered a sin.,False,4,9153,295595
3080,1527520905.0,14,GreenBayPackers,Good ol' Mick,False,0,209,64038
3081,1527472752.0,52,dogswithjobs,I run a small non profit that helps children and adults with special needs. And my Great Pyrenees Bella guards the office. She’s a good doggo.,False,0,4254,217630
3082,1527541285.0,2,norge,Helt sløkket!,False,0,74,88483
3083,1527496646.0,25,pyrocynical,Tfw the dj doesn't play despacito,False,0,1085,64228
3084,1527492806.0,48,blender,Light House,False,0,864,75393
3085,1527519581.0,7,bladerunner,Guys I’ve found where Ridley Scott gets his hair done.,False,0,221,19355
3086,1527539926.0,2,Cinemagraphs,Gentle stream,True,0,113,389048
3087,1527543514.0,1,grilledcheese,(Lots of) muenster on white,False,0,65,101259
3088,1527538194.0,4,castles,"Neuschwanstein Castle, Germany",False,0,89,68258
3089,1527526720.0,49,Shitstatistssay,"Knives are too sharp and filing them down is solution to soaring violent crime, judge says",False,0,152,20621
3090,1527508149.0,70,PewdiepieSubmissions,"So,after meme correction I decided to buy The Right Coca Cola for this meme,as you requested",False,0,3316,343122
3091,1527549916.0,6,howyoudoin,"My husband is so proud of his first paint job in our “technically, painting is allowed” apartment.",False,0,45,55141
3092,1527498000.0,246,kpop,PRISTIN V (프리스틴 V) - 네 멋대로 (Get It),False,0,1448,284122
3093,1527547838.0,1,Watercolor,"One more today, Joshua Tree, National Park, 20x20""",False,0,52,35278
3094,1527546783.0,6,USMC,Where the hell is the Marine Corps?!,False,0,79,27458
3095,1527535032.0,21,awfuleverything,Oh god those lips,False,0,96,67602
3096,1527536990.0,3,shittyrainbow6,When you complain about Tachanka memes but also force your own memes,False,0,134,58308
3097,1527551108.0,8,lucifer,My 15 y/o Daughter does SFX as a hobby and wants to #SaveLucifer so she made up my face for Tonight's Episode.,False,0,42,19895
3098,1527519933.0,108,vancouver,Prof Pavlov’s “City of Vancouver currently has the highest property taxes in Canada” graph is a lie,False,2,314,82749
3099,1527536021.0,22,philadelphia,"Happy Memorial Day, Philadelphia",False,0,97,65533
3100,1527535360.0,3,suicidebywords,This man needs a hug...,False,0,97,72451
3101,1527531854.0,17,Tinder,She has no idea that I cheated,False,0,248,944283
3102,1527544295.0,21,caps,"I bought bottles of scotch before games 6 and 7 against Tampa, so I’m keeping it going for all of the finals as well. Here’s game 1’s scotch.",False,0,90,16703
3103,1527502710.0,8,ScarySigns,No touchy touchy,False,0,507,39522
3104,1527525664.0,158,videos,Selfish Driver Refuses to Move for Rescue 1 Because They Were “Waiting for a Spot”,False,0,747,17791058
3105,1527510121.0,14,travel,Took this pic of Prague Castle in the distance. Highly recommend visiting this stunning city!,False,0,520,1025519
3106,1527532411.0,10,EmpireDidNothingWrong,Memorial Day,False,0,163,270045
3107,1527540868.0,146,TeenMomOGandTeenMom2,Doris’ emergency custody document,False,0,71,19872
3108,1527540036.0,15,JusticeServed,"Pakistan: Women Police officers escort man to jail for abusing his daughter, govt made sure only women would escort him to jail.",False,0,77,404335
3109,1527502942.0,18,nevertellmetheodds,The water also looks like an elephant,False,1,1127,607326
3110,1527549435.0,5,keto,"[PICS] M/28/6'0 [289lbs &gt; 189lbs = 100lbs] 8 months progress, feeling greater than ever",False,0,71,621745
3111,1527515489.0,32,mexico,"México exporta más a Canadá, Brasil, Corea y la Unión Europea",False,0,265,116207
3112,1527537821.0,24,chelseafc,Kalidou Koulibaly,False,0,122,99964
3113,1527515569.0,5,OTMemes,When your router says your connection is working but no pages will load,False,0,384,61835
3114,1527524337.0,127,NoStupidQuestions,Why do we give tax breaks to the rich?,False,0,169,541715
3115,1527517999.0,20,loseit,Came in 12th out of 600 at a 5K,False,0,348,849221
3116,1527531623.0,8,Archaeology,Pectoral from the tomb of Tutankhamun.,False,0,116,44399
3117,1527535887.0,11,assholedesign,The bacon this guy got,False,0,201,424032
3118,1527485383.0,10,foxes,Happy Fox!,False,0,1241,74294
3119,1527507291.0,100,formula1,It's about sending a message: Monaco Grand Prix post-race comic,False,0,863,356967
3120,1527526426.0,14,HistoryMemes,Rule brittania!,False,0,475,142219
3121,1527548222.0,5,quilting,"Contemporary quilt for a best friend's wedding gift, they loved it!",False,0,50,17161
3122,1527540461.0,17,streetwear,[WDYWT] Another Spring Outfit,False,0,111,635352
3123,1527497984.0,7,Tendies,Beware: Chaddy on the prowl,False,0,959,52530
3124,1527506273.0,4,catpictures,My favorite babe,False,0,422,83322
3125,1527521328.0,11,knifeclub,Happy Memorial Day 🇺🇸,False,0,194,48679
3126,1527523546.0,11,twinpeaks,"[ALL] candie.. CANDIE!! 👋🏻 Here’s my cosplay for Megacon this past weekend, remote control included ✨",False,0,172,71348
3127,1527537011.0,32,mildlyinteresting,I found where they keep all the road signs.,False,0,879,14305774
3128,1527533705.0,6,tattoos,"My first tattoo! Artist: Vicki Fitzpatrick @ Bournemouth Ink, UK",False,0,107,1060128
3129,1527509909.0,38,forsen,For tonight's stream - A LIDL drinking game,False,0,353,18466
3130,1527501090.0,16,nier,Someone take my editing software away,False,0,539,32331
3131,1527539394.0,2,touhou,The most elusive maid.,False,0,76,19619
3132,1527527274.0,15,science,Dolphins Have a Mysterious Network of Veins That Could Be Key to Preventing the Bends,False,0,208,18729525
3133,1527489536.0,31,Denmark,Kære Frederik...,False,0,976,92860
3134,1527516293.0,24,hmmm,hmmm,False,0,538,707238
3135,1527516518.0,6,TaylorSwiftsLegs,can't get sexier than this,False,0,244,18904
3137,1527535991.0,14,gundeals,"[Ammo]If you like $3 slugs but don't like Walmart ( Federal 12ga 2 3/4"" $3 /$0.60 Per Round )",False,0,89,147774
3138,1527513243.0,12,OffensiveMemes,100$,False,0,432,60256
3139,1527531253.0,8,Eyebleach,A rare sighting of a rainbow unicorn.,False,0,533,855435
3140,1527517397.0,16,cursedimages,cursed_bigmac,False,0,510,129148
3141,1527535675.0,4,asianpeoplegifs,"No handlebars, no problem!",True,0,92,126629
3142,1527539047.0,8,ProgrammerHumor,"Based on this subs decision tree, this content should receive the optimal number of upvotes",False,0,169,532030
3143,1527532500.0,16,ketorecipes,I made keto cauliflower kimchi fried rice!,False,0,231,246067
3144,1527531482.0,4,shield,I too am in Dublin...,False,0,167,77945
3145,1527540654.0,12,Fuhrerreich,the virgin waffen-ss vs The Chad Thuleschutztruppe,False,0,68,2979
3146,1527513630.0,18,knives,Victorinox Camper LL Bean special edition. I never appreciated SAKs until recently. Great little pocket knife!,False,0,281,122538
3147,1527509190.0,85,books,"Lolita is majorly creepy, but my god is Nabokov's narration absolutely magical",False,0,348,14572541
3148,1527535510.0,10,ShingekiNoKyojin,[MANGA SPOILERS] I found a Reiner fanart I made on my 3ds when the M***** arc started,False,0,97,88982
3149,1527515837.0,4,tattoo,Turtle Power by Faith Elise (Artist 1st tattoo),False,0,246,85441
3150,1527508903.0,47,marvelstudios,The hero we deserve,True,0,1149,402110
3151,1527541700.0,3,Braves,SOMETIMES IT PAYS TO SAVE!,False,0,98,20896
3152,1527524812.0,3,Megumin,Bikini Megumin,False,0,228,26225
3153,1527513129.0,24,DeFranco,Couple denied motel room after clerk says Puerto Rican driver's license is not U.S. ID,False,0,282,63441
3154,1527533548.0,45,todayilearned,"TIL an orgasm can clear up your sinuses. This is because your body gets a rush of adrenaline when you have an orgasm, which causes tissues in the nose to shrink, opening up passageways.",False,0,706,18824577
3155,1527513152.0,23,bisexual,No longer feeling the “weight” of my sexuality,False,0,420,79850
3156,1527544467.0,6,WeirdWheels,Seis Camino in tiny fishing village in Iceland,False,0,61,37521
3157,1527516184.0,14,malelivingspace,"After years of slowly collecting furniture, I finally have a living room.",False,0,241,266505
3158,1527527057.0,5,StarVStheForcesofEvil,Day 51 of the hiatus! Give it up for day 51!,False,0,143,22926
3159,1527533183.0,5,brooklynninenine,Booone?!,False,0,152,98892
3160,1527540577.0,2,ageofsigmar,Megaboss on Mawkrusha from the Realm of Shadow,False,0,67,14476
3161,1527508721.0,33,DesignPorn,"This coffee table seems to bend reality, and defy the laws of gravity [564x1075] (i.imgur.com)",False,0,353,381546
3162,1527504492.0,275,Drama,"""Journalist"" is accused of having her hair straightened by Elon Musk supporters",False,1,441,75827
3163,1527540778.0,9,destiny2,A toast to the end of the world,False,0,154,143215
3164,1527528157.0,66,ireland,"EU proposes ban on plastic straws, cutlery | RTÉ",False,0,194,164244
3165,1527542959.0,21,fivenightsatfreddys,Scraptrap Pixel Art (Made out of only the Game Boy color palette),False,0,63,26430
3166,1527522880.0,34,forhonor,What you got there?,False,0,371,111565
3167,1527550220.0,5,Disneyland,Really Going to miss this view!,False,0,44,42216
3168,1527491185.0,35,Fantasy,"For any of you Ursula Le Guin fans out there, here's an interpretation of Ged/Sparrowhawk from A Wizard Of Earthsea.",False,0,866,315825
3169,1527534044.0,54,gamegrumps,Guiness World Records - 10 Minute Power Hour,False,0,206,152773
3170,1527544811.0,2,DnD,[OC][Art] I also have a Geometric DnD tattoo - My Demi-Lich,False,0,124,531816
3171,1527541576.0,12,Battlecars,Around where I live,False,0,70,33133
3172,1527520524.0,84,onguardforthee,"Richard Dawkins indirectly responds to Jordan Peterson on Twitter: ""I don’t know about you, but I’m becoming heartily sick of being told the obvious nonsense that “myths” are just as valid an approach to the truth as science...""",False,0,281,18856
3173,1527513036.0,144,news,Coca-Cola launches its first alcoholic drink in Japan.,False,1,1974,16069454
3174,1527533174.0,8,Breath_of_the_Wild,I'm running circles around you!,True,1,220,189567
3175,1527532928.0,14,cringepics,"Listening to music on YouTube, always avoid the comment section",False,0,105,921560
3176,1527495839.0,225,Whatcouldgowrong,Not holding a shotgun property when pulling the trigger. WCGW,False,3,6806,1149630
3177,1527512052.0,19,ContagiousLaughter,Dominic Monaghan (Pippin) pranks Elijah Wood (Frodo) with a mock interview. Elijah just loses it as Monaghan's questions get more ridiculous.,False,0,437,566922
3179,1527529337.0,0,DisneyEyes,"Dobby wants to know why I’m not actively skritching her, so mournful disney eyes are my reward.",False,0,122,17063
3180,1527535703.0,4,farcry,"My friend says ""can you pick me up?"", I turn around and see this.",False,0,132,64398
3181,1527513034.0,12,Michigan,Lake Huron sunset!,False,0,279,45488
3183,1527527778.0,42,gaming,Saw this on Deviant Art and thought it deserves so much more attention!! (Credit: Thomasotom) Please go show him some love!,False,0,3220,18169489
3184,1527529342.0,85,funny,So fuckin true,False,0,2859,19596014
3185,1527485135.0,155,wholesomememes,Harold is too wholesome for us.,True,2,9882,1483192
3186,1527547513.0,0,NatureIsFuckingLit,🔥 Forest Path 🔥,False,0,236,1118321
3187,1527534521.0,12,xxfitness,Squatted my body weight last night!,False,0,95,263123
3188,1527507824.0,592,CryptoCurrency,Whats going on with Nano?,False,0,533,679298
3189,1527516677.0,17,Cricket,"Dhoni: ""No, Bravo keeps padding up on his own"".",False,0,231,71614
3190,1527512879.0,25,PUBGMobile,Tencent headquarters (leaked footage),True,0,280,31947
3191,1527507683.0,18,PKA,"Let's get this to the top of google images when you search for ""Most handsome man in North Carolina""",False,0,534,35322
3192,1527526754.0,72,progun,"Sheriff: Parents, don't bring guns to school lockdowns",False,0,136,36760
3193,1527540565.0,148,AskMen,"You have a girlfriend who made you wait until the 10th date before having sex with you. Midway through your relationship, you find out she has a long history of casual sex and hookups with guys she barely knew. How would you react?",False,0,64,593213
3194,1527551123.0,1,noisygifs,The laugh at the end and the little nod,False,0,42,124135
3195,1527518578.0,5,intermittentfasting,Mr. Lovenstein gets it (credit - http://www.mrlovenstein.com/comic/370),False,0,209,102026
3196,1527471516.0,479,mildlyinfuriating,Fuck you Erin,False,3,25868,957611
3197,1527519568.0,31,gardening,Picture of outside of Greenhouse I built for my Neighbours farm market. About 90% built,False,0,628,647967
3198,1527538405.0,1,shittymoviedetails,In Stanley Kubrick’s Full Metal Jacket (1987) all of the actors had to do their own push ups as CGI was too expensive at the time,False,0,110,39954
3199,1527512458.0,11,HistoryPorn,"A US soldier mocks Hitler, c. 1944-45. [962 x 1451] (Colorized)",False,0,414,936870
3200,1527531367.0,2,offlineTV,We all need a Janet in our lives tbh,False,0,164,68663
3201,1527511779.0,3138,AskReddit,"Non-French redditors, what's something you want clarifying from our culture, language?",False,1,2081,19279565
3202,1527534768.0,21,WhitePeopleTwitter,The buffest cat on the block,False,0,422,514423
3203,1527501450.0,84,iphone,Weird iPhone recorded conversation over Bluetooth,False,0,495,586841
3204,1527544533.0,2,minnesota,"It's official, today May 28th marks the first day in 2018 where the temperature in Minnesota has hit 100°. About a month ago we had over a foot of snow.",False,0,56,45891
3205,1527517757.0,17,Memes_Of_The_Dank,Harry Sicker,False,0,325,111697
3206,1527478422.0,37,WeatherGifs,Oman storm brings three years' rainfall in single day,False,0,1615,169382
3207,1527536447.0,21,FireEmblemHeroes,Can I interest you Feh lunchbox today?,False,0,391,106253
3208,1527547702.0,3,tumblr,Sexual tension,False,0,223,343543
3209,1527535289.0,3,Bossfight,"Jugglicor, the Tri-handed Mage",True,0,128,281134
3210,1527524186.0,55,bostonceltics,[Himmelsbach] Rozier on Kyrie: “As far as the starting thing I’m not really worried about that. He’s our starter.”,False,0,331,52181
3211,1527519149.0,3,absolutelynotmeirl,abSOLUtelyNotMeiRl,False,0,201,101615
3212,1527543374.0,9,jurassicworldevo,Early test of the dilophosaurus animations,False,0,56,5302
3213,1527531560.0,3,Graffiti,Candie (more in comments),False,0,154,240105
3214,1527550263.0,13,newzealand,Meth house contamination debunked by PM's science advisor,False,0,40,141994
3215,1527532393.0,4,NLSSCircleJerk,Canadian kid can't believe what he got for Christmas!,False,0,219,29205
3216,1527539013.0,9,Indiana,My thoughts as a visitor driving through for the Indy 500,False,0,73,15047
3217,1527539268.0,3,woahdude,These moving dots from r/oddlysatisfying,False,0,70,1787094
3218,1527531396.0,46,interestingasfuck,An animatronic gorilla,False,1,1070,2169577
3219,1527537647.0,12,starwarsrebels,"Dryden Vos, the villain in Solo: A Star Wars Story was almost a Lasat",False,0,75,20684
3220,1527538306.0,22,facepalm,Darn I really thought they were that size.,False,0,354,1324970
3221,1527509842.0,135,trashy,Funeral,False,0,1013,733811
3222,1527542878.0,12,polandball,Of Döners and Debts,False,0,129,408691
3223,1527538048.0,14,vandwellers,Long overdue intro to the community.,False,0,107,203966
3224,1527543201.0,1,Colorado,Mountain goats on Mount Evans today,False,0,54,47055
3225,1527529458.0,18,terriblefacebookmemes,"If kids had the fear of having lamps thrown at their head, there wouldn't be any school shootings",False,0,173,161709
3226,1527520278.0,9,LoveNikki,Lady of the Lake,False,0,187,12600
3227,1527492621.0,31,beholdthemasterrace,My oppressors,False,0,759,102786
3228,1527529106.0,8,Embroidery,newest lil hoop! I’m so grateful by how much love and support I’m getting by my peers and even strangers! Thoughts on this one?,False,0,119,28664
3229,1527525876.0,14,vainglorygame,"aewitched Celeste! This is the skin Ive gotten from the Gwen vs Reza event and I just thought of drawing it since her costume is rather easy than her other skins haha. Sadly, I dont main Celeste.. but I find her really strong if used properly. I hope you guys will like this!",False,0,140,21621
3230,1527489527.0,69,wowthanksimcured,"wake up, sheeple!",False,1,888,39649
3231,1527525669.0,39,BattlefieldV,Have fun playing but never forget...,False,0,205,13587
3232,1527543642.0,2,MadeMeSmile,A bit overprotective,False,0,182,612878
3233,1527538254.0,5,BikiniBottomTwitter,Things are about to get H E A T E D,False,0,154,687247
3234,1527477962.0,159,StarWars,What do you guys think of my cardboard Millennium Falcon? So excited to see Solo!!,False,0,7140,881147
3235,1527548273.0,6,nosleep,Teddy Bears and Plastic Cups,False,0,67,12288338
3236,1527517579.0,96,PUBATTLEGROUNDS,I got unbanned (from a false positive ban)and here's how,False,0,672,615772
3237,1527549789.0,2,arcticmonkeys,Some more Star Treatment,False,0,62,28685
3238,1527534677.0,3,CatSlaps,A bit harsh,False,0,88,99809
3239,1527515463.0,59,Seaofthieves,Am I the only one?,False,0,506,110088
3240,1527509125.0,97,UnresolvedMysteries,Pennsylvania residents hearing strange noises in the night,False,0,324,428985
3241,1527509857.0,50,popheads,Kylie Minogue turns 50!,False,0,311,45782
3242,1527492500.0,1,ImaginaryCharacters,Deep in the forest by Wadim Kashin,False,0,756,75899
3243,1527546240.0,1,HoldMyKibble,HMK while I catch this toy!,False,0,48,26475
3244,1527549982.0,7,EarthPorn,I love northeast Ohio in the spring time [OC] [3024x4032],False,0,200,15314496
3245,1527512579.0,76,Borderlands2,Started playing yesterday for the first time,False,0,270,68644
3246,1527521239.0,21,thatHappened,the girl? she grew up to be obama,False,0,171,627662
3247,1527541361.0,7,MaliciousCompliance,In which I had some questionable expenses,False,0,293,419065
3248,1527530845.0,9,americandad,Me this weekend,False,0,105,26262
3249,1527503795.0,44,BlackPeopleTwitter,I'm still working on my #beachbody,False,0,5032,1723232
3250,1527517018.0,45,HumansBeingBros,Police Officer saves a choking infant’s life,True,0,676,565068
3251,1527542080.0,46,CasualConversation,i wish you could see how happy you are,False,0,56,371914
3252,1527548250.0,31,buildapcsales,[CPU] $192 AMD RYZEN 7 1700 OCTA-CORE (8 CORE) 3 GHZ PROCESSOR,False,0,47,367998
3253,1527540471.0,11,bois,🧜‍♂️,False,0,66,44560
3254,1527535047.0,85,NintendoSwitch,FYI: E3 being 2 weeks away doesn’t mean there’s no chance of a direct between then and now. Last year’s Pokemon Direct was shown on 6/6/17.,False,0,183,617691
