,created_utc,num_comments,subreddit,title,is_video,num_crossposts,score,subreddit_subscribers
1000,1527518518.0,33,catpictures,found a stray kitty. gave him food but he really just want attention. more than happy to give him that.,False,0,615,83322
1001,1527535081.0,5,lgbt,Greetings,False,0,393,213302
1002,1527537667.0,21,xboxone,I made a polygonal version of Masterchief from Halo 4,False,0,334,741851
1003,1527524276.0,15,barstoolsports,We Are All Witnesses.,False,0,461,39230
1004,1527502060.0,279,FellowKids,Y'all like Fortnite??,False,0,5144,348457
1005,1527532322.0,2,GlitchInTheMatrix,Dogs master the art of the mannequin.,False,0,302,52611
1006,1527549905.0,7,serialkillers,Picture of Ted Bundy during court,False,0,123,89424
1007,1527524851.0,35,Jokes,My first joke on reddit. Hope it hasn't been told too often,False,0,967,13650866
1008,1527523539.0,44,AgainstHateSubreddits,Nimble navigator from the_donald proposes mass murder with poison gas in response to people on welfare existing.,False,0,474,44910
1009,1527542957.0,7,Vermintide,sigmars holy cause knows no rest,False,0,175,41000
1010,1527547192.0,1,TIGHTPUSSY,Kitten in a donut,False,1,143,23109
1011,1527535007.0,13,softwaregore,idk if legoland is worth all that distance,False,0,392,316245
1012,1527500840.0,199,MaliciousCompliance,You can't work holidays if you're at 40 hours for the week!,False,0,3605,419064
1013,1527545282.0,16,Mariners,[MarinersPR] Today's #Mariners starter @MarcoGonzales_ worked 6.2 innings and did not allow an earned run...he's gone 19.1 consecutive IP without allowing an EARNED run.,False,0,154,18198
1014,1527534662.0,48,Supernatural,[No Spoilers][Shitpost] Was casually watching some old TV and spotted a familiar face.,False,0,266,77535
1015,1527517732.0,75,ArtisanVideos,A passionate man mows his lawn to perfection,False,0,636,409275
1016,1527505518.0,29,camping,"Nothing better then the early morning silence, campfire and of course coffee. Commence my summer baptism!",True,1,1213,254613
1017,1527528879.0,17,hamiltonmusical,"It may be the nosebleed, but after two years of savin’ I’m past patiently waitin’. I made it to the room where it happens.",False,0,356,23616
1018,1527548185.0,5,ComedyNecrophilia,A Pennsylvania jury found Bill Cosby guilty of three counts of aggravated indecent assault on Thursday,False,0,135,31405
1019,1527528845.0,10,masterforgiveme,He’s not clowning around,False,0,359,31123
1020,1527531004.0,24,2meirl4meirl,2meirl4meirl,False,0,1048,358628
1021,1527507971.0,88,kpop,"President of South Korea, Moon Jae-in, congratulates BTS on their album's success on the Billboard 200 albums chart",False,1,1556,284122
1022,1527515302.0,25,HumansBeingBros,This is Jake. At the Indy 500 Snake Pit (a concert in the middle of the track) on Sunday it was 92 degrees and Jake repeatedly would go out of his way to get dehydrated kids some cold water. He also did it with a smile on his face the whole time. Thanks Jake.,False,0,1599,565064
1023,1527539307.0,16,GTAorRussia,Fire Fighting Airplane in Action,False,1,206,43538
1024,1527547212.0,180,nintendo,I'm Dylan Cuthbert and I worked on four versions of Star Fox and our new game PixelJunk Monsters 2 is out NOW! I'm old and wise :) AMA,False,0,143,528236
1025,1527522289.0,39,JoeRogan,Edgy Brah after one elk meat from Rogan,False,0,495,130235
1026,1527526126.0,32,anthologymemes,When you watch Solo with someone who hasn't seen Clone Wars,False,1,406,17946
1028,1527523383.0,88,warriors,#WARRIORS ARE #BLESSED FOR TODAYS #NBA GAME !!! - Lil B,False,0,688,103586
1029,1527533962.0,23,TankPorn,Värnkanon 74 mobile coastal defense trailer,False,1,271,35665
1030,1527534170.0,5,DestroyedTanks,"Knocked out Iraqi T-54/55 in the Kuwait oilfields, 1991 Gulf War",False,0,271,23617
1031,1527542338.0,23,joinsquad,It's so true that it hurts,False,0,174,24954
1032,1527527188.0,97,oculus,"Beat Saber sold 100,000 copies in less than a month",False,0,382,116568
1033,1527526509.0,103,CanadaPolitics,"PARKIN: Almost everywhere, conservatives have become the party of fiscal recklessness",False,0,388,52234
1034,1527522095.0,64,justlegbeardthings,Heterosexual relationships are socially acceptable prostitution,False,0,496,41810
1036,1527524772.0,10,WholesomeComics,Mini comic: family,False,0,428,34170
1038,1527517141.0,20,backpacking,"Found this hidden gem in Dominguez Canyon, CO.",False,0,645,396591
1039,1527515930.0,546,funny,I may never need to post again,False,15,43729,19595973
1040,1527542932.0,26,philosophy,Totalitarianism In Our Time: Arendt and Trump,False,0,169,12768063
1041,1527519419.0,65,WWE,Happy Birthday Seth Rollins!!,True,0,561,77119
1043,1527493854.0,211,ireland,Irish Girls,False,0,2114,164244
1044,1527502763.0,40,WhatsWrongWithYourDog,Rescue pitty isn't very photogenic but she sure is sweet!,False,1,3247,225476
1045,1527525564.0,20,theocho,Adorably unique,False,0,409,226837
1046,1527527079.0,6,wholesomebpt,I too enjoy messaging the same person on multiple platforms,False,0,380,156596
1047,1527526253.0,33,vinyl,"Just moved from Georgia to Colorado, unpacked and set up before anything else...",False,0,395,291774
1048,1527478146.0,54,KeanuBeingAwesome,Keanu being the (loved) One,False,0,6014,110132
1049,1527548446.0,5,Catholicism,Melkite deacon and his daughter,False,0,130,44197
1050,1527539115.0,6,recipes,Chipotle-Maple Sweet Potato Breakfast Bowls,False,0,207,562180
1052,1527531963.0,120,PKA,"Wings' Surgery lies exposed: My story of being approved for a gastric sleeve procedure with Dr. Fernando Garcia. (warning, a bit long)",False,0,295,35322
1053,1527519929.0,610,MemeEconomy,Saw the template and thought I'd give it a go. Invest?,False,0,1202,534654
1054,1527541288.0,16,photocritique,What do you think about the colours/ positioning?,False,0,186,185657
1055,1527520276.0,18,fakehistoryporn,"The filming of 13 Reasons Why season 2, 2018 (colorized)",False,0,1197,315300
1057,1527537579.0,7,Tendies,The Normies Are Stealing our Vocabulary,False,0,231,52530
1058,1527536586.0,37,ShingekiNoKyojin,[Manga Spoilers] [Art] As time goes by,False,1,236,88982
1059,1527536897.0,4,BirdsBeingDicks,Rainbow lorikeet among pink flowers,False,0,228,56284
1060,1527517694.0,8,engrish,Found on r/memes,False,0,904,116501
1061,1527541470.0,4,homestuck,Jade Harley Aesthetic,False,0,180,28829
1062,1527534366.0,10,hittableFaces,The WWE UK Champion,False,0,257,46870
1063,1527534276.0,9,mapmaking,[Humor] Gotta Love He-Man’s Maps,False,0,260,29962
1064,1527539694.0,16,pitbulls,"I was warned not to have two females but I haven’t had any issues. Here’s my two girls, Lacy and Chance!",False,0,289,70606
1065,1527508696.0,57,iamverysmart,The Human sun dial speaks,False,0,1453,688252
1066,1527530530.0,13,LittleWitchAcademia,Real life trio,False,0,312,8019
1067,1527545170.0,3,analog,"prism x55555 [minolta x370, 50mm 1.8, lomography 400]",False,0,159,183401
1068,1527519836.0,149,PS4,"Battlefield V on Twitter: ""There are no more Battlepacks. Instead, players will be able to choose their rewards directly or through rank up events.""",False,0,790,902868
1069,1527548899.0,0,Zoomies,My cousin has been travelling the world for the past 8 months. Her dog realised today that she’d come home!,False,0,192,290609
1070,1527538868.0,12,araragi,My Little Sisters Can't Be This Cute,False,0,203,22315
1072,1527519996.0,44,SCP,Can someone identify this one?,False,0,531,116305
1073,1527537621.0,3,TheCatTrapIsWorking,amazon box house,False,0,214,21643
1074,1527540770.0,16,physicsgifs,Drawing dotted lines on a blackboard - Slow mo,False,0,185,76135
1075,1527513234.0,44,psychology,"Being torn about which personal goals to pursue is associated with symptoms of psychological distress, suggests new research based on more than 200 young adults, which found that goal conflict and ambivalence were independently associated with anxious and depressive symptoms.",False,0,748,366059
1076,1527541287.0,10,Denver,Denver's sunrises are the best there are.,False,0,179,65908
1077,1527510261.0,145,Seaofthieves,For those eagerly awaiting the Hungering Deep update tomorrow...,False,0,1325,110088
1078,1527523161.0,10,GalGadot,Tank Top - GIF,False,0,446,29134
1079,1527494383.0,228,bicycling,"My longest solo ride, ride through the night",False,0,1996,280069
1080,1527532591.0,9,dontputyourdickinthat,Seems like a good blowjob to me,False,0,277,42353
1081,1527517886.0,104,todayilearned,"TIL that after surviving a car accident and receiving a settlement, Paul Dennis Reid used the money to get a plastic surgery, and then pursued a career as a country singer, under the stage name Justin Parks. When that failed, he became a serial killer.",False,0,2892,18824544
1082,1527529677.0,15,Anarchism,Design for a poster I came up with recently,False,0,324,94022
1083,1527532763.0,152,ontario,Ipos (May 25-27): PC 37 / NDP 34 / LIB 22,False,0,276,30074
1084,1527530501.0,37,retrogaming,Just need Zelda and Tetris for the full set!,False,0,307,60595
1085,1527542837.0,34,HailCorporate,Trying [Major Soda Brand] for the first time,False,0,167,135460
1086,1527517049.0,60,dragonballfighterz,Me on the 31st,False,0,615,62256
1087,1527493646.0,108,thanosdidnothingwrong,So my friend sent this to me...,True,1,3650,80393
1088,1527525062.0,37,NLSSCircleJerk,This man is actually clinically insane,False,0,596,29205
1089,1527517910.0,20,philadelphia,Wawa goose spotted on Fishtown bathroom wall.,False,0,579,65533
1090,1527535851.0,26,TheHandmaidsTale,I found Handmaid style boots and I swear I’ve never bought something so quick.,False,0,231,24981
1091,1527503728.0,226,patientgamers,Am I the only one that doesnt give half a shit about the absetergo story in Assassins Creed?,False,0,1210,194773
1092,1527504551.0,19,itsaunixsystem,[Captured old commercial] Giant blue screens get the point across,False,0,1162,110092
1093,1527504255.0,28,MrRobot,How I spent one day in New York,False,0,1170,133540
1094,1527496776.0,112,trashy,Is anyone else tired of the “literally trashy” posts of littering and such? Can we all agree that trash on the floor/sidewalk is trashy and not post it here? It’s neither interesting nor amusing.,False,0,4710,733810
1095,1527490792.0,141,de,Die deutsche Sprache in einer Nussschale,False,1,3936,111279
1096,1527546874.0,13,Defenders,New set photos of IRON FIST Season 2 show Colleen Wing has a [SPOILER] on her [SPOILER],False,0,131,61179
1097,1527541530.0,3,Badfaketexts,Haha get it? Cause she thought it was a compliment LOL,False,0,258,170592
1098,1527541820.0,4,wholesomegifs,What getting a guitar from your favorite band feels like,False,0,256,137258
1099,1527513060.0,27,CowChop,"It started as a CowChop hot sauce logo. The Japanese Kanji under the name says ""chop sauce"" &amp; the one near the knife says ""cow"". The milk rating system is the scale for how hot it is. Hope you guys like it! :)",False,0,745,56613
1102,1527517791.0,14,AntiJokes,A horse walks into a bar.,False,0,586,155857
1103,1527512775.0,31,awfuleyebrows,I'm not sure why she does her eyebrows like this :(,False,0,747,89912
1104,1527520419.0,67,IsTodayFridayThe13th,Is Today Friday the 13th?,False,0,504,24074
1105,1527500896.0,11,ramen,Google doesn’t know shit,False,0,1381,96900
1106,1527513723.0,12,LateStageCapitalism,'Murica,False,3,1057,295595
1107,1527536228.0,7,BoJackHorseman,It's more than a show,False,0,333,147727
1109,1527524349.0,25,Torontobluejays,How Gibby decides where Martin will play...,False,0,406,36753
1110,1527524117.0,162,FortNiteBR,I noticed that slurp juice jars say “Le Jar”,False,0,3786,646001
1111,1527529235.0,14,virginvschad,Virgin Ren VS Chad Maul,False,0,325,16812
1112,1527531163.0,22,malefashion,what I wore a while back,False,0,292,100347
1114,1527528212.0,46,shittyfoodporn,TIL if you let your child pour their own syrup they will invent “Pancake Soup”,False,0,735,439454
1115,1527482453.0,49,shittyreactiongifs,When I'm in the mood for sex but my girlfriend isn't,False,2,7265,290020
1117,1527524048.0,5,catsareliquid,Our cow loves to melt in the sun,False,1,614,39609
1119,1527527886.0,42,italy,Strade romane d'Italia (grafico moderno),False,1,348,111624
1120,1527510154.0,23,disneyvacation,How to bully your dog appropriately,False,0,1265,277005
1121,1527541417.0,0,shiba,Enlightened Shiba Will Show You The Way,False,0,173,38743
1122,1527530821.0,19,Scotland,"Aye, pretty pleasant today...",False,0,295,47745
1123,1527538409.0,11,garlicoin,"Well, desperate times call for desperate measures.",False,0,202,124949
1124,1527547679.0,27,australia,Greens want inquiry into awarding of $444m Great Barrier Reef grant,False,0,189,218580
1130,1527542556.0,10,DumpsterDiving,I found a cardboard tube campus move out and these posters were in it.,False,0,163,57008
1134,1527532924.0,47,niceguys,He’s never hit a woman in his life!!!,False,0,392,473271
1135,1527511664.0,18,Miniworlds,Mini cliff,False,0,779,50635
1136,1527526452.0,18,lotrmemes,How hard is it to check the pulse?,False,0,551,66444
1137,1527546355.0,8,Handwriting,"I’ve been trying to teach myself how to handletter and I’m terrible at it. However, this has to be the prettiest r I’ve ever written.",False,0,135,72508
1138,1527549868.0,11,AmateurRoomPorn,"My Sunny living room // Portland, OR",False,0,165,134569
1139,1527547713.0,5,Megturney,Since people seem to like it,False,0,120,35928
1140,1527514121.0,106,TrueOffMyChest,My 2 year old son is a psychopath,False,0,689,96208
1141,1527528750.0,12,marijuanaenthusiasts,Beautiful Tulip Poplar I found during a hike,False,0,323,126006
1142,1527533577.0,35,bodybuilding,The greatest back double biceps of all time,False,0,254,376083
1143,1527535253.0,9,Beekeeping,Bees vs Wasps [xPost from /r/hvac],False,0,235,36889
1144,1527521270.0,49,TopMindsOfReddit,"""We don't hate Jews in this subreddit,"" says Top Mind of /r/conspiracy who in the same comment accused the Jews of controlling the media, said they were behind 9/11, and endorsed the pseudoscientific and antisemitic book ""The Culture of Critique.""",False,0,471,86452
1145,1527523971.0,36,Tinder,You can but try,False,0,912,944272
1146,1527517610.0,47,Liberal,"Black Defendants Get Longer Sentences From Republican-Appointed Judges, Study Finds",False,0,571,50383
1148,1527505694.0,16,Unexpected,"The Las Vegas Strip, last bastion of the damned",False,0,2444,1318703
1149,1527515428.0,159,teslamotors,When getting out of your model 3. Don’t push on the plastic right by the seat.,False,1,941,265208
1152,1527512621.0,99,APStudents,"Taking 38 AP courses next year, is that enough?",False,0,733,22179
1153,1527513905.0,320,programming,Bjarne Stroustroup - Remeber the Vasa [critique of modern C++ direction],False,0,688,1080365
1154,1527544555.0,6,KitchenConfidential,Talking in the restaurant,False,0,226,101148
1155,1527513365.0,18,billwurtzmemes,I have a crush on a Mexican man but he looks really young and I was wondering,False,0,712,19088
1156,1527507732.0,19,disney,My second fantasy pin. Inspired by Finding Dory.,False,0,940,114630
1158,1527537679.0,72,LiverpoolFC,"OFFICIAL: #LFC sign defensive midfielder Fabinho, 24, from Monaco on a five-year deal for an initial €45 million + potential €5m in add-ons. ( £39.3m + £4.4m)",False,0,657,96777
1159,1527510275.0,63,lego,"Penny, my amazing assistant, passed away unexpectedly this week. She loved to ""help me"" build. Let your cats help you, because you may never know when they may not around to lend a paw.",False,0,1226,336633
1161,1527504758.0,9,wallpaper,Your dream island. it will change you. [3840×2160],False,1,1119,442305
1162,1527529790.0,37,gatekeeping,Mangokeeping,False,0,441,283386
1163,1527534352.0,38,creepy,"Antony Gormley’s Another Place. Crosby Beach, Liverpool, England.",False,0,766,12212359
1164,1527538838.0,15,megalophobia,Giant floating peacock,False,0,191,42239
1165,1527531380.0,7,terriblefacebookmemes,I can't tell if it's serious or not because of who posted it...,False,0,414,161708
1166,1527518830.0,29,awfuleverything,This look,False,0,527,67601
1167,1527535474.0,22,IncrediblesMemes,"I didn’t watch Solo: A Star Wars Story, but bought 8 tickets to Incredibles 2. With Solo struggling in the box office ITS SHOWTIME. Can we beat Solo?",False,0,230,17478
1168,1527545180.0,8,SaltLakeCity,Spring in Utah is stunning,False,0,141,24756
1169,1527523982.0,39,Gundam,My friends tell me I might have a problem,False,0,403,33992
1170,1527522128.0,22,survivor,All I see amidst the memes,False,0,451,49865
1171,1527519074.0,24,parrots,My boring gray cockatiel. Today she finally made kissy noises instead of just screaming :'),False,0,513,32159
1172,1527538576.0,25,Miata,Excited to be part of the Miata family! Flew and drove back 500 miles. 05 Lava Orange Mazdaspeed.,False,0,193,26542
1173,1527479852.0,147,natureismetal,Eagle bones (West coast British Columbia),False,3,8955,528233
1174,1527535835.0,102,UnsolvedMysteries,"22 days ago, a redditor posted a terrifying voicemail left on his machine, and there's been not a single update since.",False,0,220,89879
1175,1527549340.0,25,bjj,After 3.5 years I got promoted to Blue Belt over the Weekend....Still waiting for this to kick in,False,0,110,81251
1176,1527518368.0,29,blessedimages,blessed_date,False,0,534,12066
1177,1527507554.0,129,forhonor,"This execution would be so sick for Warden... Am I the only one, who wants this realized?",True,0,1420,111565
1178,1527535380.0,57,emulation,Removing Nintendo of America's Censorship,False,0,226,81299
1179,1527529558.0,15,Bioshock,[OC] Bioshock Inked-Bouncer,False,0,299,55780
1180,1527537795.0,14,KGATLW,LUCAS APPRECIATION POST - doesn’t get enough credit for how talented of a bassist he is,False,0,196,12879
1181,1527551330.0,4,oddlyterrifying,Creepy Netflix glitch,True,0,103,78580
1182,1527549147.0,6,perfectloops,Security C[A]meras,False,0,165,263605
1183,1527532022.0,44,AskWomen,"Female Welders, What are your experiences in the industry?",False,0,267,572213
1184,1527520275.0,32,ketorecipes,Keto Fluff!,False,0,480,246050
1185,1527526117.0,9,Warhammer,Truescale Emperor's Children Legion Lord Commander,False,0,351,72137
1186,1527515134.0,17,meirl,me irl,False,0,932,443635
1187,1527535626.0,16,bettafish,"The tank has been cycled, planted, and growing for several months, looked at hundreds of betta fish but I just hadn’t found one I really loved ... until today...this little guy is coming home with me! Meet Milo!",False,0,218,33391
1188,1527524354.0,41,gay,"Gay couple stabbed in neck, back and hand for holding hands in public",False,0,391,58412
1189,1527489733.0,333,Music,Violent Femmes - Blister in the Sun [Alt Rock],False,0,6685,16938204
1190,1527540214.0,41,buildapcsales,[Laptop] Dell G3 15 Gaming Laptop w/ i5-8300H Processor + GTX 1050ti - $536 ($720 - $50 (Coupon Code: 50OFF699) - 20% Rebate (TopCashback)),False,0,175,367998
1191,1527531351.0,10,offlineTV,Is this Disguised Toast? Chibi Fanart,False,0,432,68663
1192,1527523382.0,8,The_Congress,"Obama administration was corrupt, more and more evidence reveals daily",False,0,415,32352
1193,1527548020.0,20,BattlefieldV,Leaked Footage of Dice developers working on reload animations for BFV.,True,0,116,13587
1194,1527550686.0,5,ussoccer,Walker Zimmerman scores his first USA goal vs Bolivia [1-0],False,0,99,26235
1195,1527478889.0,198,surrealmemes,https://resist.jpg,False,5,18749,312719
1196,1527536351.0,5,Jeep,Happy memorial day guys!,False,0,213,59735
1197,1527520523.0,16,gay_irl,gay_irl,False,0,690,43747
1198,1527504310.0,68,3Dprinting,Iris Box Timelapse,True,0,1080,188979
1199,1527514938.0,27,AskHistorians,"The first King of Portugal was a Medieval Erasmus kid: the son of a Burgundian knight and a Castillian noblewoman, he ruled over a population speaking Galaico-Portuguese and Arabic. Do we know what languages he spoke, and if he had an accent? Wasn't he seen as a foreigner in the eyes of the natives?",False,1,914,754608
1200,1527522641.0,25,4x4,The new rear suspension,False,0,414,34394
1201,1527518170.0,31,destiny2,Destiny poster Infinity war / Guardians of the galaxy style done by me :),False,0,780,143213
1202,1527543440.0,57,stocks,"[8 months ago] ""My dad has $1.8 million dollars worth of GE. What should he do?"" ""Leave him be...""",False,1,146,239450
1203,1527529293.0,46,assholedesign,I wanted a good thick comb for my barbarian beard. Glad I opened this before I bought it.,False,0,644,424024
1204,1527537306.0,8,headphones,"Do you use FiiO portable music players? Do you use iTunes on Mac? Are you annoyed trying to create playlists on your FiiO? I wrote a script to take care of it, here ya go (free!).",False,0,198,162303
1205,1527525254.0,317,AMA,I was “kidnapped” overnight and taken to a wilderness camp. AMA,False,0,368,258582
1206,1527524194.0,24,farcry,"Don't feed him ACTUAL Cheeseburgers, because, you know, he's got the diabetes.",False,0,387,64398
1207,1527548372.0,18,hiking,Said goodbye to my hiking partner today,False,0,169,228089
1208,1527536060.0,4,WhitePeopleTwitter,The hard naked truth about celebrities,False,0,454,514414
1209,1527521149.0,66,FireEmblemHeroes,Sakura as Cardcaptor Sakura ;u;,False,0,1492,106252
1210,1527476195.0,108,photoshopbattles,PsBattle: Thumbs up cat,False,2,20686,13171947
1211,1527529684.0,19,homestead,Planted the garden on April 29. Picked these yesterday May 27.,False,0,294,244662
1212,1527534403.0,8,MiniJello,Oldie but goodie,False,0,229,15938
1213,1527535180.0,69,argentina,Obligan a las empresas de servicios a poner en su sitio web un link para que el usuario pueda darse de baja,False,0,219,62669
1214,1527538488.0,8,C25K,Still can’t believe I do 5km runs now 😂😂,False,0,191,72462
1215,1527513116.0,1,LatinoPeopleTwitter,La mañana después de llevarla a bailar,False,0,674,62648
1216,1527498475.0,1167,news,Migrant who saved young boy to be made French citizen,False,1,13782,16069438
1217,1527525809.0,9,shittybattlestations,Found on r/gaming,False,0,354,43848
1218,1527520571.0,4,germanshepherds,Worn out after a fun filled day at the dog park.,False,0,461,35561
1219,1527544827.0,19,Lost_Architecture,"Tri-Faith chapels at JFK Airport. Built in 1966 and demolished in 1989, to make way for a car parking lot.",False,0,135,19617
1220,1527552712.0,12,MLS,Josh Sargent scores on his USA Senior debut vs Bolivia [2-0],False,0,136,83357
1221,1527516907.0,68,robotics,1st public demo of Wandercraft's autonomous exoskeleton to help disabled people walk again with France president Macron. We're hiring.,True,1,551,55556
1222,1527528954.0,68,mildlyinteresting,Troll sculpture under a bridge in Fremont [Seattle],False,0,2202,14305753
1223,1527541421.0,9,BigBrother,Scrolled through memes on Instagram and saw a familiar face,False,0,161,60511
1224,1527543524.0,8,Graffiti,New style I'm trying out,False,0,150,240102
1225,1527487436.0,127,MovieDetails,"In Aladdin (1992) Genie is NOT the only character with 4 fingers, despite what the recent post said.",False,0,4241,657613
1226,1527543241.0,12,brasil,A maior força política do Brasil é o tiozão do zap,False,0,210,168080
1227,1527551438.0,2,blender,A New Bic,False,0,96,75392
1228,1527535058.0,17,Tekken,WTF Mokujin ?,False,0,213,34525
1229,1527550264.0,4,CozyPlaces,Perfect for Netflix and a glass of wine. Found on instagram,False,0,153,444322
1230,1527515840.0,45,PeopleFuckingDying,MaN FuCkINg kIllinG InoCCenT FlAmInGos fOr MonEy,False,0,1987,681709
1231,1527501510.0,28,worldbuilding,Aunt Maddie - Entanglement with a Carnivorous Fungi,False,0,1197,268135
1232,1527509405.0,39,MadeMeSmile,Couple with Down's syndrome celebrate 22 years of marriage.,False,0,2888,612874
1233,1527509079.0,23,keming,Life is beautif ul.,False,0,811,109846
1234,1527528594.0,21,DankMemesFromSite19,O5 hate him! Find out how he passed a memetic kill agent with this simple trick!,False,0,302,21659
1235,1527515299.0,71,Conservative,Alabama student who woke up at 4.30am every morning to get a bus to his high school is gifted a car after graduation,False,1,869,135940
1236,1527487905.0,54,creepyPMs,The nerve of some people,False,0,4204,363220
1237,1527520972.0,21,educationalgifs,Making a knife from Lignum Vitae wood,False,0,648,601801
1238,1527520577.0,11,hmmmgifs,hmmm,False,1,447,48323
1239,1527541439.0,9,rarepuppers,Dancer doggo,False,0,495,651777
1240,1527546064.0,32,nostalgia,"Anyone remember Heads Down, Thumbs Up?",False,0,181,408342
1241,1527509072.0,177,unpopularopinion,I think it's weird to name your son after yourself,False,0,817,66737
1242,1527540341.0,6,onguardforthee,Poll: Majority of Ontarians somewhat creeped out with Doug Ford calling them 'friends',False,0,164,18856
1243,1527542786.0,20,keto,Down 90lbs and I’m feeling awesome,False,0,216,621734
1244,1527537515.0,43,OutOfTheLoop,What's the Kerbal Space Program drama about?,False,0,284,877373
1245,1527540655.0,20,vegan,Proof that it’s easy to road trip and camp as a vegan!,False,0,238,193969
1246,1527518426.0,8,Moonmoon,Watcha drinkin'?,False,0,495,17470
1247,1527504148.0,42,FrankOcean,HOW MANY PEOPLE LISTEN TO THIS?,False,0,1042,75667
1248,1527531174.0,8,penguins,"""As an NHL player, I've never really wanted another team to win the Stanley Cup as much as I want Vegas to win... [Fleury] is a special dude."" Trevor Daley (3:30 till the end)",False,0,263,27482
1249,1527518662.0,38,supremeclothing,Just pickled cucumbers in Supreme jars,False,0,489,107778
1250,1527525703.0,18,Disneyland,..DCA is Magical,False,0,342,42216
1251,1527538207.0,7,PornhubComments,This is Sparta,False,0,273,115631
1252,1527521692.0,12,ShokugekiNoSoma,Meme Monday - Azameme,False,1,419,27359
1253,1527533824.0,38,stevenuniverse,[Updated] Even more canon family tree of Steven Universe,False,0,338,122408
1254,1527525268.0,38,furry_irl,Furry🙀irl,False,0,519,33185
1255,1527476198.0,165,CollegeBasketball,Don't let the Celtics blowing a 2-0 series lead distract from the fact that No. 16 UMBC beat No. 1 Virginia,False,0,5083,269747
1256,1527533634.0,10,urbanexploration,100m under city,False,0,332,506547
1257,1527550610.0,23,VictoriaBC,r/victoriabc starterpack,False,0,101,14823
